,author,created_utc,id,num_comments,permalink,score,title,selftext,subreddit,selftext_clean,title_clean,selftext_ngrams,title_ngrams
52077,thelasian,2018-06-04 06:48:14,8of97p,77,/r/23andme/comments/8of97p/genetic_ancestry_testing_is_a_scam/,0,Genetic ancestry testing IS A SCAM,"**Genetic Ancestry tracing tests are  nothing more than a total and complete a scam**

These ancestry testing claims are **total bullshit scams** that are actually marketed as novelty items (like the pet rock)


&gt;**But claims that this analysis will tell you much about where you came from are downright fraudulent**, anthropologist Deborah Bolnick of the University of Texas at Austin and 14 co-authors recently reported. https://www.livescience.com/2084-dna-kits-secrets-scientific-scam.html


(and before anyone wastes time saying these sceintific reports debunking genetic ancestry tests are ""old"" then you'd better have more recent similar scientific studies that *verify* these tests'  accuracy  -- or else keep your *mere opinions* on the matter to yourself.)

More

&gt;Nor can genetic tests verify a person’s race or ethnicity. Genes that 
affect skin pigmentation or blood proteins involved in malarial resistance, the authors note, may not measure direct and unique ancestry (for example, a founder effect), but reflect instead an evolutionary response to “shared environmental exposures.” Furthermore, the tests are based on comparisons to databases of DNA from living populations, and are therefore vulnerable to “systematic bias” because of “incomplete geographic sampling” or the fact that “present-day patterns of residence are rarely identical to what existed in the past.” One testing company even uses an underlying model that “reinforces the archaic racial view that four discrete ‘parental’ populations (Africans, Europeans, East Asians, and Native Americans) existed in the past” even though “there is little evidence that four biologically discrete groups of humans ever existed….” https://harvardmagazine.com/2008/05/race-in-a-genetic-world-html


As for the medical claims of these tests:

&gt;Recently, Fullwiley’s concerns have centered on a new kind of genetic testing. **For a substantial fee, companies such as 23andMe will “tell you what your propensity is for hypertension, schizophrenia, breast cancer, lactose intolerance, and high or low IQ,” she says. But the studies that have established links between genes and these outcomes are probabilistic, she says, and convey, like ancestry tests, what might be called a false precision Except for known Mendelian traits or conditions (such as Huntington’s disease) only a fraction of people with a gene variant linked to a disease actually become ill. https://harvardmagazine.com/2008/05/race-in-a-genetic-world-html

What happens when triplets tested:

http://www.insideedition.com/investigative/21784-how-reliable-are-home-dna-ancestry-tests-investigation-uses-triplets-to-find-out

 
Also read this: https://www.telegraph.co.uk/news/worldnews/northamerica/usa/1416706/DNA-survey-finds-all-humans-are-99.9pc-the-same.html

Note where it says there's more genetic variety *within* populations rather then *between* them. 
\

\





Persians are simply people who speak Persian and they come in all colors, just as ""Arabs"" simply mean people who speak Arabic rather than a ""race"" or a specific genetic group. These languages have historically been spoken by lots of different people

Iranians come in all sorts and have historically consisted of vast movements of large populations, going back to neanderthals, and ""Persian"" like ""Arab"" are merely descriptions of the *language* not genetics of people; there is no such thing as ""Persian"" genes or ""Caucasian"" genes or ""Southern European"" or ""Italian"" genes, since genes don't understand political borders, and terms such as ""Europe"" or ""Asia"" of ""Africa"" etc are themselves also arbitrary man-made *labels* for arbitrary *chunks of geography* not genetically isolated human populations which are somehow unique and distinct from other populations. Oh and Italy didn't even exist 100 years ago


No one even audits the results of these tests, for all you know some guy is sitting in his shorts and writing the results for you based on his imagination while smoking a joint. Nobody is checking the ancestry tracing claims, these are not verified in any way at all.  
 
More:

http://www.slate.com/articles/technology/future_tense/2016/06/dna_testing_cannot_determine_ancestry_including_elizabeth_warren_s.html

Telling you that you share some genes with everyone from Siberia to S America is not really worth the money: https://www.gizmodo.com.au/2011/04/why-23andme-genetic-testing-is-a-waste-of-time-and-money/
 
**Nobody can cite a SINGLE actual scientific review that validates the results from these ancestry tracing tests** and until someone does or is themselves a geneticists, frankly **I am not really interested in hearing about psuedo-scientific theories in any responses from Redditors who are butthurt over the fact that genetic ancestry testing is  in fact confirmed to be scientifically a complete and utter scam.**

They're just exploiting race anxiety for profit





https://www.youtube.com/watch?v=I3mo851rd_I

Like I said, no one can find a SINGLE ACTUAL SCIENTIFIC article that ACTUALLY validates these ancestry tests -- and don't bother me with any amateur geneticist attempts on reddit as a substitute",23andme,"['genetic', 'ancestry', 'tracing', 'test', 'nothing', 'total', 'complete', 'scam', 'ancestry', 'testing', 'claim', 'total', 'bullshit', 'scam', 'actually', 'marketed', 'novelty', 'item', 'like', 'rock', 'claim', 'analysis', 'tell', 'much', 'came', 'downright', 'fraudulent', 'anthropologist', 'deborah', 'bolnick', 'university', 'texas', 'austin', 'co-authors', 'recently', 'reported', 'http', '//www.livescience.com/2084-dna-kits-secrets-scientific-scam.html', 'anyone', 'waste', 'time', 'saying', 'sceintific', 'report', 'debunking', 'genetic', 'ancestry', 'test', 'better', 'recent', 'similar', 'scientific', 'study', 'verify', 'test', 'accuracy', 'else', 'keep', 'mere', 'opinion', 'matter', 'genetic', 'test', 'verify', 'person', 'race', 'ethnicity', 'gene', 'affect', 'skin', 'pigmentation', 'blood', 'protein', 'involved', 'malarial', 'resistance', 'author', 'note', 'measure', 'direct', 'unique', 'ancestry', 'example', 'founder', 'effect', 'reflect', 'instead', 'evolutionary', 'response', 'shared', 'environmental', 'exposures.', 'furthermore', 'test', 'based', 'comparison', 'database', 'living', 'population', 'therefore', 'vulnerable', 'systematic', 'bias', 'incomplete', 'geographic', 'sampling', 'fact', 'present-day', 'pattern', 'residence', 'rarely', 'identical', 'existed', 'past.', 'testing', 'company', 'even', 'underlying', 'model', 'reinforces', 'archaic', 'racial', 'view', 'four', 'discrete', 'parental', 'population', 'african', 'european', 'east', 'asian', 'native', 'american', 'existed', 'past', 'even', 'though', 'little', 'evidence', 'four', 'biologically', 'discrete', 'group', 'human', 'ever', 'existed….', 'http', '//harvardmagazine.com/2008/05/race-in-a-genetic-world-html', 'medical', 'claim', 'test', 'recently', 'fullwiley', 'concern', 'centered', 'kind', 'genetic', 'testing', 'substantial', 'company', '23andme', 'tell', 'propensity', 'hypertension', 'schizophrenia', 'breast', 'cancer', 'lactose', 'intolerance', 'high', 'study', 'established', 'link', 'gene', 'outcome', 'probabilistic', 'convey', 'like', 'ancestry', 'test', 'might', 'called', 'false', 'precision', 'except', 'known', 'mendelian', 'trait', 'condition', 'huntington', 'disease', 'fraction', 'people', 'gene', 'variant', 'linked', 'disease', 'actually', 'become', 'ill.', 'http', '//harvardmagazine.com/2008/05/race-in-a-genetic-world-html', 'happens', 'triplet', 'tested', 'also', 'read', 'http', '//www.telegraph.co.uk/news/worldnews/northamerica/usa/1416706/dna-survey-finds-all-humans-are-99.9pc-the-same.html', 'note', 'genetic', 'variety', 'within', 'population', 'rather', 'persian', 'simply', 'people', 'speak', 'persian', 'come', 'color', 'arab', 'simply', 'mean', 'people', 'speak', 'arabic', 'rather', 'race', 'specific', 'genetic', 'group', 'language', 'historically', 'spoken', 'different', 'people', 'iranian', 'come', 'sort', 'historically', 'consisted', 'vast', 'movement', 'large', 'population', 'going', 'back', 'neanderthal', 'persian', 'like', 'arab', 'merely', 'description', 'language', 'genetics', 'people', 'thing', 'persian', 'gene', 'caucasian', 'gene', 'southern', 'european', 'italian', 'gene', 'since', 'gene', 'understand', 'political', 'border', 'term', 'europe', 'asia', 'africa', 'also', 'arbitrary', 'man-made', 'label', 'arbitrary', 'chunk', 'geography', 'genetically', 'isolated', 'human', 'population', 'somehow', 'unique', 'distinct', 'population', 'italy', 'even', 'exist', 'year', 'even', 'audit', 'result', 'test', 'know', 'sitting', 'short', 'writing', 'result', 'based', 'imagination', 'smoking', 'joint', 'nobody', 'checking', 'ancestry', 'tracing', 'claim', 'verified', 'telling', 'share', 'gene', 'everyone', 'siberia', 'america', 'really', 'worth', 'money', 'http', '//www.gizmodo.com.au/2011/04/why-23andme-genetic-testing-is-a-waste-of-time-and-money/', 'nobody', 'cite', 'single', 'actual', 'scientific', 'review', 'validates', 'result', 'ancestry', 'tracing', 'test', 'someone', 'geneticist', 'frankly', 'really', 'interested', 'hearing', 'psuedo-scientific', 'theory', 'response', 'redditors', 'butthurt', 'fact', 'genetic', 'ancestry', 'testing', 'fact', 'confirmed', 'scientifically', 'complete', 'utter', 'scam', 'exploiting', 'race', 'anxiety', 'profit', 'like', 'said', 'find', 'single', 'actual', 'scientific', 'article', 'actually', 'validates', 'ancestry', 'test', 'bother', 'amateur', 'geneticist', 'attempt', 'reddit', 'substitute']","['genetic', 'ancestry', 'testing', 'scam']","['genetic', 'ancestry', 'tracing', 'test', 'nothing', 'total', 'complete_scam', 'ancestry', 'testing', 'claim', 'total_bullshit', 'scam', 'actually', 'marketed_novelty', 'item', 'like', 'rock', 'claim', 'analysis', 'tell', 'much', 'came_downright_fraudulent', 'anthropologist_deborah_bolnick', 'university_texas', 'austin_co-authors', 'recently', 'reported_http_//www.livescience.com/2084-dna-kits-secrets-scientific-scam.html', 'anyone', 'waste_time', 'saying', 'sceintific', 'report', 'debunking', 'genetic', 'ancestry', 'test', 'better', 'recent', 'similar', 'scientific_study', 'verify', 'test', 'accuracy', 'else', 'keep', 'mere', 'opinion', 'matter', 'genetic', 'test', 'verify', 'person', 'race', 'ethnicity', 'gene', 'affect', 'skin_pigmentation', 'blood', 'protein', 'involved', 'malarial', 'resistance', 'author', 'note', 'measure', 'direct', 'unique', 'ancestry', 'example', 'founder_effect', 'reflect', 'instead', 'evolutionary', 'response', 'shared', 'environmental', 'exposures.', 'furthermore', 'test', 'based', 'comparison', 'database', 'living', 'population', 'therefore', 'vulnerable', 'systematic', 'bias', 'incomplete', 'geographic', 'sampling', 'fact', 'present-day', 'pattern', 'residence', 'rarely', 'identical', 'existed', 'past.', 'testing_company', 'even', 'underlying', 'model', 'reinforces', 'archaic', 'racial', 'view', 'four', 'discrete', 'parental', 'population', 'african', 'european', 'east_asian_native_american', 'existed', 'past', 'even_though', 'little', 'evidence', 'four', 'biologically', 'discrete_group', 'human', 'ever', 'existed….', 'http_//harvardmagazine.com/2008/05/race-in-a-genetic-world-html', 'medical', 'claim', 'test', 'recently', 'fullwiley', 'concern', 'centered', 'kind', 'genetic_testing', 'substantial', 'company', '23andme', 'tell', 'propensity', 'hypertension', 'schizophrenia', 'breast_cancer', 'lactose_intolerance', 'high', 'study', 'established', 'link', 'gene', 'outcome', 'probabilistic', 'convey', 'like', 'ancestry', 'test', 'might', 'called', 'false', 'precision', 'except', 'known', 'mendelian_trait', 'condition', 'huntington_disease', 'fraction', 'people', 'gene_variant', 'linked', 'disease', 'actually', 'become', 'ill.', 'http_//harvardmagazine.com/2008/05/race-in-a-genetic-world-html', 'happens', 'triplet', 'tested', 'also', 'read', 'http', '//www.telegraph.co.uk/news/worldnews/northamerica/usa/1416706/dna-survey-finds-all-humans-are-99.9pc-the-same.html', 'note', 'genetic_variety', 'within', 'population', 'rather', 'persian', 'simply', 'people', 'speak', 'persian', 'come', 'color', 'arab', 'simply', 'mean', 'people', 'speak_arabic', 'rather', 'race', 'specific', 'genetic_group', 'language', 'historically', 'spoken', 'different', 'people', 'iranian', 'come', 'sort', 'historically', 'consisted', 'vast', 'movement', 'large', 'population', 'going_back', 'neanderthal', 'persian', 'like', 'arab', 'merely', 'description', 'language', 'genetics', 'people', 'thing', 'persian', 'gene', 'caucasian', 'gene', 'southern_european', 'italian', 'gene', 'since', 'gene', 'understand', 'political_border', 'term', 'europe_asia', 'africa', 'also', 'arbitrary', 'man-made', 'label', 'arbitrary', 'chunk_geography', 'genetically_isolated', 'human', 'population', 'somehow', 'unique', 'distinct', 'population', 'italy', 'even', 'exist', 'year', 'even', 'audit', 'result', 'test', 'know', 'sitting', 'short', 'writing', 'result', 'based', 'imagination', 'smoking', 'joint', 'nobody', 'checking', 'ancestry', 'tracing', 'claim', 'verified', 'telling', 'share', 'gene', 'everyone', 'siberia', 'america', 'really', 'worth_money', 'http', '//www.gizmodo.com.au/2011/04/why-23andme-genetic-testing-is-a-waste-of-time-and-money/', 'nobody', 'cite', 'single', 'actual', 'scientific', 'review', 'validates', 'result', 'ancestry', 'tracing', 'test', 'someone', 'geneticist', 'frankly', 'really', 'interested_hearing', 'psuedo-scientific', 'theory', 'response', 'redditors', 'butthurt', 'fact', 'genetic', 'ancestry', 'testing', 'fact', 'confirmed', 'scientifically', 'complete_utter', 'scam', 'exploiting', 'race', 'anxiety', 'profit', 'like', 'said', 'find', 'single', 'actual', 'scientific_article', 'actually', 'validates', 'ancestry', 'test', 'bother', 'amateur', 'geneticist', 'attempt', 'reddit', 'substitute']","['genetic', 'ancestry', 'testing', 'scam']"
52564,whoami345,2018-05-08 03:58:50,8htu01,15,/r/23andme/comments/8htu01/inaccurate_ancestry_reports/,11,Inaccurate ancestry reports?,"I am Vietnamese, but my maternal grandmother is half-French. However my [ancestry report](https://i.imgur.com/TPoO7x3.png) is not showing any European ancestry. Is the 23andMe report inaccurate, or was my grandmother mistaken about her ancestry? I definitely have some non-Asian traits though, like ample body hair, big eyes, lactose tolerance, etc.",23andme,"['vietnamese', 'maternal', 'grandmother', 'half-french', 'however', 'ancestry', 'report', 'http', '//i.imgur.com/tpoo7x3.png', 'showing', 'european', 'ancestry', '23andme', 'report', 'inaccurate', 'grandmother', 'mistaken', 'ancestry', 'definitely', 'non-asian', 'trait', 'though', 'like', 'ample', 'body', 'hair', 'lactose', 'tolerance']","['inaccurate', 'ancestry', 'report']","['vietnamese', 'maternal_grandmother', 'half-french', 'however', 'ancestry', 'report', 'http', '//i.imgur.com/tpoo7x3.png', 'showing', 'european', 'ancestry', '23andme', 'report', 'inaccurate', 'grandmother', 'mistaken', 'ancestry', 'definitely', 'non-asian', 'trait', 'though', 'like', 'ample', 'body_hair', 'lactose_tolerance']","['inaccurate', 'ancestry', 'report']"
52675,Chimerain,2018-05-02 22:10:46,8gld79,6,/r/23andme/comments/8gld79/i_suspect_a_mix_up/,0,I suspect a mix up...,"I've had my 23andMe Health \+ Ancestry results for a few months, and more and more I suspect a mix up in the lab. For starters, many of the 'traits' listed are incorrect\- things I can clearly see like baldness, back hair, hair color, lactose intolerance, photic sneeze reflex are all incorrectly predicted in my results... which I know aren't meant to be definitive \(hence the 'likely' wording added to results\) but on top of that, all of my 'genetic relatives' have unfamiliar last names \(despite some being as close as second cousins\). In fact, my last name and any relatives last names all the way back to my grandparents do not appear anywhere in any surname lists for possible relatives.

As far as any curveballs in my results \(like being adopted\), I have very little doubt that I am my father's son\- when comparing pictures of both of us when we were 10, we look like we could be twins. So, what's another possibility? Could the lab have accidentally switched samples? When it comes to blood work, errors and mix ups are surprisingly common\- but when there is a discrepancy they can always retest; But at 23andMe your sample is automatically tied to your identity, and there seems to be very little recourse if you suspect a mix up of your genetic test results. I guess I could try to get my father or brother to take the test, but both have been apprehensive about sharing genetic information and I don't want to pressure them into it. The only other thing I can think to do is to take the Ancestry.com test and find somewhere to have the raw data analyzed to see if they're even a match. Does anyone know of a 3rd party company that would do something like this?",23andme,"['23andme', 'health', 'ancestry', 'result', 'month', 'suspect', 'starter', 'many', ""'traits"", 'listed', 'incorrect\\-', 'thing', 'clearly', 'like', 'baldness', 'back', 'hair', 'hair', 'color', 'lactose', 'intolerance', 'photic', 'sneeze', 'reflex', 'incorrectly', 'predicted', 'result', 'know', 'meant', 'definitive', 'hence', ""'likely"", 'wording', 'added', 'results\\', ""'genetic"", 'relative', 'unfamiliar', 'last', 'name', 'despite', 'close', 'second', 'cousins\\', 'fact', 'last', 'name', 'relative', 'last', 'name', 'back', 'grandparent', 'appear', 'anywhere', 'surname', 'list', 'possible', 'relative', 'curveballs', 'result', 'like', 'adopted\\', 'little', 'doubt', 'father', 'son\\-', 'comparing', 'picture', 'look', 'like', 'could', 'twin', 'another', 'possibility', 'could', 'accidentally', 'switched', 'sample', 'come', 'blood', 'work', 'error', 'surprisingly', 'common\\-', 'discrepancy', 'always', 'retest', '23andme', 'sample', 'automatically', 'tied', 'identity', 'seems', 'little', 'recourse', 'suspect', 'genetic', 'test', 'result', 'guess', 'could', 'father', 'brother', 'take', 'test', 'apprehensive', 'sharing', 'genetic', 'information', 'want', 'pressure', 'thing', 'think', 'take', 'ancestry.com', 'test', 'find', 'somewhere', 'data', 'analyzed', 'even', 'match', 'anyone', 'know', 'party', 'company', 'would', 'something', 'like']",['suspect'],"['23andme', 'health', 'ancestry', 'result', 'month', 'suspect', 'starter', 'many', ""'traits"", 'listed', 'incorrect\\-', 'thing', 'clearly', 'like', 'baldness', 'back', 'hair', 'hair_color', 'lactose_intolerance', 'photic_sneeze_reflex', 'incorrectly', 'predicted', 'result', 'know', 'meant', 'definitive', 'hence', ""'likely"", 'wording', 'added', 'results\\', ""'genetic"", 'relative', 'unfamiliar', 'last_name', 'despite', 'close', 'second', 'cousins\\', 'fact', 'last_name', 'relative', 'last_name', 'back', 'grandparent', 'appear', 'anywhere', 'surname', 'list', 'possible', 'relative', 'curveballs', 'result', 'like', 'adopted\\', 'little', 'doubt', 'father', 'son\\-', 'comparing', 'picture', 'look_like', 'could', 'twin', 'another', 'possibility', 'could', 'accidentally_switched', 'sample', 'come', 'blood', 'work', 'error', 'surprisingly', 'common\\-', 'discrepancy', 'always', 'retest', '23andme', 'sample', 'automatically', 'tied', 'identity', 'seems', 'little', 'recourse', 'suspect', 'genetic', 'test', 'result', 'guess', 'could', 'father', 'brother', 'take_test', 'apprehensive', 'sharing', 'genetic', 'information', 'want', 'pressure', 'thing', 'think', 'take', 'ancestry.com', 'test', 'find', 'somewhere', 'data', 'analyzed', 'even', 'match', 'anyone', 'know', 'party', 'company', 'would', 'something', 'like']",['suspect']
