,author,created_utc,id,num_comments,permalink,score,title,selftext,subreddit,selftext_clean,title_clean,selftext_ngrams,title_ngrams
3940,redratus,2022-08-15 23:41:07,wpenil,0,/r/23andme/comments/wpenil/how_accurate_is_the_lactose_intolerance_variant/,1,How accurate is the lactose intolerance variant?,"My results say “based on your genetics, you are likely to be lactose intolerant”.

But I eat dairy all the time. If I drink a ton of milk I might get so e gas but other than that im fine. What do these results mean? How accurate are they?",23andme,"['result', 'based', 'genetics', 'likely', 'lactose', 'intolerant', 'dairy', 'time', 'drink', 'milk', 'might', 'fine', 'result', 'mean', 'accurate']","['accurate', 'lactose', 'intolerance', 'variant']","['result', 'based', 'genetics', 'likely', 'lactose_intolerant', 'dairy', 'time', 'drink_milk', 'might', 'fine', 'result', 'mean', 'accurate']","['accurate', 'lactose_intolerance', 'variant']"
4541,chaimpeck,2022-08-01 03:36:56,wd78eb,0,/r/23andme/comments/wd78eb/how_to_use_snpedia_with_raw_data/,1,How to use snpedia with raw data?,"I downloaded my raw data. I am curious about rs4988235, as I *am* lactose intolerant. Here is the snpedia entry:  
[https://www.snpedia.com/index.php/Rs4988235](https://www.snpedia.com/index.php/Rs4988235)

It lists three possibilities:

* C;C
* C;T
* T;T

The line from my raw data says:

    rs4988235	2	136608646	GG

Is it supposed to be the compliment (so ""CC"")? But, if so, then there are other entries that don't make sense when looking at snpedia.

Also, what is up with genotypes that say ""II"" or ""DD""?

I am obviously misunderstanding something with how to read this. I think that this is something that I can understand, but I am just looking for a little help in getting started with looking up entries on snpedia and trying to match them with my raw data manually.",23andme,"['downloaded', 'data', 'curious', 'rs4988235', 'lactose', 'intolerant', 'snpedia', 'entry', 'http', '//www.snpedia.com/index.php/rs4988235', 'http', '//www.snpedia.com/index.php/rs4988235', 'list', 'three', 'possibility', 'line', 'data', 'rs4988235', '136608646', 'supposed', 'compliment', 'entry', 'make', 'sense', 'looking', 'snpedia', 'also', 'genotype', 'obviously', 'misunderstanding', 'something', 'read', 'think', 'something', 'understand', 'looking', 'little', 'help', 'getting', 'started', 'looking', 'entry', 'snpedia', 'trying', 'match', 'data', 'manually']","['snpedia', 'data']","['downloaded_data', 'curious', 'rs4988235', 'lactose_intolerant', 'snpedia', 'entry', 'http', '//www.snpedia.com/index.php/rs4988235', 'http', '//www.snpedia.com/index.php/rs4988235', 'list', 'three', 'possibility', 'line', 'data', 'rs4988235', '136608646', 'supposed', 'compliment', 'entry', 'make_sense', 'looking', 'snpedia', 'also', 'genotype', 'obviously', 'misunderstanding', 'something', 'read', 'think', 'something', 'understand', 'looking', 'little', 'help', 'getting', 'started', 'looking', 'entry', 'snpedia', 'trying', 'match', 'data', 'manually']","['snpedia', 'data']"
7895,Kneekourt,2022-05-10 18:40:19,umpkf3,0,/r/23andme/comments/umpkf3/question_about_the_point_of_23_andme/,1,Question About the Point of 23 andMe,"Hi, I’m a Korean adoptee whose boyfriend gifted her a 23andMe kit. 

Upon getting my results, I’m confused on how/why this information should be useful to me. Example: I’m likely to be lactose intolerant (I’m actually not). However, if I was, wouldn’t I just look at this info and say, “Well, yea, duh.” Or that I’m more likely to have brown eyes… 

I guess I’m wondering how to use this information. Is there something I’m not seeing/understanding?",23andme,"['korean', 'adoptee', 'whose', 'boyfriend', 'gifted', '23andme', 'upon', 'getting', 'result', 'confused', 'how/why', 'information', 'useful', 'example', 'likely', 'lactose', 'intolerant', 'actually', 'however', 'look', 'info', 'well', 'duh.', 'likely', 'brown', 'eyes…', 'guess', 'wondering', 'information', 'something', 'seeing/understanding']","['question', 'point', 'andme']","['korean_adoptee', 'whose', 'boyfriend', 'gifted', '23andme', 'upon', 'getting', 'result', 'confused', 'how/why', 'information', 'useful', 'example', 'likely', 'lactose_intolerant', 'actually', 'however', 'look', 'info', 'well', 'duh.', 'likely', 'brown', 'eyes…', 'guess', 'wondering', 'information', 'something', 'seeing/understanding']","['question', 'point', 'andme']"
10770,R1A-M2,2022-03-01 08:32:31,t43acy,12,/r/23andme/comments/t43acy/bihar_india/,1,"Bihar, India","My father's family is from the Mithila region near the Nepal border. My mother's family is mostly from the Magadha region, with some family from the Bhojpur region as well. There is report on both sides of the family of ancient ancestry going back to Eastern UP. I'm from a caste group called Bhumihar which is found only in Western Bihar, Eastern UP, and the adjacent districts of Nepal and Jharkhand. 

In terms of traits, I'm lactose tolerant by one allele, wet earwax by one allele, and have the elite athlete gene by one allele (though I've never had success in sports and don't even like watching sports).

Haplogroups are R-L657 and M2. 

  

https://preview.redd.it/91ruc8nhgqk81.png?width=3414 ;format=png ;auto=webp ;s=a5c63366036f924591a2caa2fa45b831433d8246

https://preview.redd.it/3jppn8nhgqk81.png?width=3440 ;format=png ;auto=webp ;s=28d8bcbc8dc4467148df832d9810a0f397a01ee8

https://preview.redd.it/36d7q8nhgqk81.png?width=2182 ;format=png ;auto=webp ;s=89d515896deac097adcdcdac1029fc84c953947d

https://preview.redd.it/zgx428nhgqk81.png?width=1008 ;format=png ;auto=webp ;s=614a5614cb4e9f32262888747d909da43414463b

https://preview.redd.it/26d478nhgqk81.png?width=2398 ;format=png ;auto=webp ;s=b5ebd947fd12153089a4ea54d7b754436c8d16b7",23andme,"['father', 'family', 'mithila', 'region', 'near', 'nepal', 'border', 'mother', 'family', 'mostly', 'magadha', 'region', 'family', 'bhojpur', 'region', 'well', 'report', 'side', 'family', 'ancient', 'ancestry', 'going', 'back', 'eastern', 'caste', 'group', 'called', 'bhumihar', 'found', 'western', 'bihar', 'eastern', 'adjacent', 'district', 'nepal', 'jharkhand', 'term', 'trait', 'lactose', 'tolerant', 'allele', 'earwax', 'allele', 'elite', 'athlete', 'gene', 'allele', 'though', 'never', 'success', 'sport', 'even', 'like', 'watching', 'sport', 'haplogroups', 'r-l657']","['bihar', 'india']","['father', 'family', 'mithila', 'region', 'near', 'nepal', 'border', 'mother', 'family', 'mostly', 'magadha', 'region', 'family', 'bhojpur', 'region', 'well', 'report', 'side', 'family', 'ancient', 'ancestry', 'going_back', 'eastern', 'caste', 'group', 'called', 'bhumihar', 'found', 'western', 'bihar', 'eastern', 'adjacent', 'district', 'nepal', 'jharkhand', 'term', 'trait', 'lactose_tolerant', 'allele', 'earwax', 'allele', 'elite_athlete', 'gene', 'allele', 'though', 'never', 'success', 'sport', 'even', 'like', 'watching', 'sport', 'haplogroups', 'r-l657']","['bihar', 'india']"
34537,LadyFetila,2020-08-07 13:25:29,i5dqzy,5,/r/23andme/comments/i5dqzy/how_to_read_values_of_snp/,1,How to read values of SNP?,"Hi! There seems to be system that I cannot understand for SNPs.

For example SNPedia says that rs4988235 (lactose intolerance related) can gain values of C and T.
My 23andMe variants shows possibilities of A or G.

How to reconcile that information?",23andme,"['seems', 'system', 'understand', 'example', 'snpedia', 'rs4988235', 'lactose', 'intolerance', 'related', 'gain', 'value', '23andme', 'variant', 'show', 'possibility', 'reconcile', 'information']","['read', 'value']","['seems', 'system', 'understand', 'example', 'snpedia', 'rs4988235', 'lactose_intolerance', 'related', 'gain', 'value', '23andme', 'variant', 'show', 'possibility', 'reconcile', 'information']","['read', 'value']"
39225,BambiaAmber,2020-02-03 01:24:08,exyzit,5,/r/23andme/comments/exyzit/health_risk/,1,Health risk,"Hi there I did the health and it said I have increased risk for diabetes and also could have an overuse Deficiency in iron..  everything else was fine thank god and I'm not too worried but was just wondering if I should mention it to my GP or just brush it off...
It also said I was tolerant to lactose but at the same time according to my hospital records I'm allergic to milk and egg white. I'm not sure if I should be concerned or just carry on. Like right now I'm not too worried but at the same time I'm wondering if I should start changing lifestyle habits or something.",23andme,"['health', 'said', 'increased', 'risk', 'diabetes', 'also', 'could', 'overuse', 'deficiency', 'iron', 'everything', 'else', 'fine', 'thank', 'worried', 'wondering', 'mention', 'brush', 'also', 'said', 'tolerant', 'lactose', 'time', 'according', 'hospital', 'record', 'allergic', 'milk', 'white', 'sure', 'concerned', 'carry', 'like', 'right', 'worried', 'time', 'wondering', 'start', 'changing', 'lifestyle', 'habit', 'something']","['health', 'risk']","['health', 'said', 'increased_risk', 'diabetes', 'also', 'could', 'overuse', 'deficiency', 'iron', 'everything_else', 'fine', 'thank', 'worried', 'wondering', 'mention', 'brush', 'also', 'said', 'tolerant', 'lactose', 'time', 'according', 'hospital', 'record', 'allergic', 'milk', 'white', 'sure', 'concerned', 'carry', 'like', 'right', 'worried', 'time', 'wondering', 'start', 'changing', 'lifestyle', 'habit', 'something']",['health_risk']
39961,tamadomokus,2020-01-11 19:36:28,enc18j,24,/r/23andme/comments/enc18j/hungarian_magyar_person_here/,1,Hungarian (magyar) person here. :),"Hi! I am **Hungarian**, 28 years old. We, Hungarians are quite mixed compared to other European nations. All the Hungarians I saw on 23andme had about 50% Eastern European DNA: 20-30% Hungarian, 10-30% Slavic ancestry (mostly Polish, Slovakian, maybe Ukrainian). They also usually have 10-40% French ;German. I knew that I have these: German, Polish, Slovakian; but I was totally shocked by the 20% Southern European DNA...I mean... 10% Italian...and Greek?? Wow. I think it's cool! I am almost everything from Europe!

https://preview.redd.it/9q76atpm97a41.png?width=1334 ;format=png ;auto=webp ;s=8055d9f3c31666211d9684df03189a537d55e1a4

Details:  
My parents told me that my maternal grandpa was Gypsy/Romani, he was totally brown skinned, and he has black hair. I think I inherited the Southern European genes from him, and he was not Gypsy (did not even have Roma facial features), because Gypsies/Romani people came from northern India, and I have no Asian DNA. So maybe that is why I can tan in the summer, but because of the German genes, my hair becomes almost blonde. My natural hair color is ""dark blonde"" or about light brown, it depends on the light circumstances and the weather. I have kinda thin hair, so very long hair is not for me (it has no volume), but at least it is easy to handle (it takes every kind of shape, and because of the light weight of my hair I usually seem insane. :) All in all, some days my hair hair is straight, some days wavy, some days caothic, some days pony tail shaped...and never curly (only if I iron it). Sometimes my eyes look black, but they are actually brown with green shade. My nose is kinda northern type, it is thin, long and has a bump at the middle of my nosebridge. There I have few freckles in the summer. I have more Neanderthal DNA than 90% of 23andme customers. Yes!! :D Physically I am a late bloomer, I got my first period at the age of 15 and a half years. I always looked 2-3 years younger than my actual age, also now, as an adult (people think I am 22-25 years old). My parents were late bloomers, too, so I think it is genetics. I have hereditary lactose intolerance, just like my father. Both parents have thin bones, so do I. But my bones are rather elastic, I never broke one. I am 1.61 m (5'3-5'4 inches) tall, my weight is 50 kg (110 pounds) on average, but I am currently 55 kg, and I am a pear shape, so I have a very skinny upper body, average sized boobs (70B), thick booty and thighs without having African DNA. :D I have Brachydactyly type D from my mother (her mother has it as well). My blood type is A Rh+ (father: 0+, mother: AB+). My IQ is high (according to my studies and Mensa, it is something 130+), I am very analytic (as you can see) and emotional, I have a strong sixth sense, and I get overwhelmed by the emotions of my surrounding...I do not know if it is a genetic trait, but I sometimes experience telepathy too, even if you don't believe me (actually I am a very rational person, but I know the limits of my knowledge). I think telepathy could have been an evolutionary trait for surviving. Hm... I talk a lot... :D Ok, that's all. I hope this was interesting. :) Have a nice day!",23andme,"['hungarian', 'year', 'hungarian', 'quite', 'mixed', 'compared', 'european', 'nation', 'hungarian', '23andme', 'eastern', 'european', '20-30', 'hungarian', '10-30', 'slavic', 'ancestry', 'mostly', 'polish', 'slovakian', 'maybe', 'ukrainian', 'also', 'usually', '10-40', 'french', 'german', 'knew', 'german', 'polish', 'slovakian', 'totally', 'shocked', 'southern', 'european', 'mean', 'italian', 'greek', 'think', 'cool', 'almost', 'everything', 'europe', 'detail', 'parent', 'told', 'maternal', 'grandpa', 'gypsy/romani', 'totally', 'brown', 'skinned', 'black', 'hair', 'think', 'inherited', 'southern', 'european', 'gene', 'gypsy', 'even', 'facial', 'feature', 'gypsies/romani', 'people', 'came', 'northern', 'india', 'asian', 'maybe', 'summer', 'german', 'gene', 'hair', 'becomes', 'almost', 'blonde', 'natural', 'hair', 'color', 'dark', 'blonde', 'light', 'brown', 'depends', 'light', 'circumstance', 'weather', 'kinda', 'thin', 'hair', 'long', 'hair', 'volume', 'least', 'easy', 'handle', 'take', 'every', 'kind', 'shape', 'light', 'weight', 'hair', 'usually', 'seem', 'insane', 'hair', 'hair', 'straight', 'wavy', 'caothic', 'pony', 'tail', 'shaped', 'never', 'curly', 'iron', 'sometimes', 'look', 'black', 'actually', 'brown', 'green', 'shade', 'nose', 'kinda', 'northern', 'type', 'thin', 'long', 'bump', 'middle', 'nosebridge', 'freckle', 'summer', 'neanderthal', '23andme', 'customer', 'physically', 'late', 'bloomer', 'first', 'period', 'half', 'year', 'always', 'looked', 'year', 'younger', 'actual', 'also', 'adult', 'people', 'think', '22-25', 'year', 'parent', 'late', 'bloomer', 'think', 'genetics', 'hereditary', 'lactose', 'intolerance', 'like', 'father', 'parent', 'thin', 'bone', 'bone', 'rather', 'elastic', 'never', 'broke', '1.61', 'inch', 'tall', 'weight', 'pound', 'average', 'currently', 'pear', 'shape', 'skinny', 'upper', 'body', 'average', 'sized', 'boob', 'thick', 'booty', 'thigh', 'without', 'african', 'brachydactyly', 'type', 'mother', 'mother', 'well', 'blood', 'type', 'father', 'mother', 'high', 'according', 'study', 'mensa', 'something', '130+', 'analytic', 'emotional', 'strong', 'sixth', 'sense', 'overwhelmed', 'emotion', 'surrounding', 'know', 'genetic', 'trait', 'sometimes', 'experience', 'telepathy', 'even', 'believe', 'actually', 'rational', 'person', 'know', 'limit', 'knowledge', 'think', 'telepathy', 'could', 'evolutionary', 'trait', 'surviving', 'talk', 'hope', 'interesting', 'nice']","['hungarian', 'magyar', 'person']","['hungarian', 'year', 'hungarian', 'quite', 'mixed', 'compared', 'european', 'nation', 'hungarian', '23andme', 'eastern_european', '20-30', 'hungarian', '10-30', 'slavic', 'ancestry', 'mostly', 'polish', 'slovakian', 'maybe', 'ukrainian', 'also', 'usually', '10-40', 'french_german', 'knew', 'german', 'polish', 'slovakian', 'totally', 'shocked', 'southern_european', 'mean', 'italian', 'greek', 'think', 'cool', 'almost', 'everything', 'europe', 'detail', 'parent', 'told', 'maternal_grandpa', 'gypsy/romani', 'totally', 'brown_skinned', 'black_hair', 'think', 'inherited', 'southern_european', 'gene', 'gypsy', 'even', 'facial_feature', 'gypsies/romani', 'people', 'came', 'northern_india', 'asian', 'maybe', 'summer', 'german', 'gene', 'hair', 'becomes', 'almost', 'blonde', 'natural_hair_color', 'dark_blonde_light_brown', 'depends', 'light', 'circumstance', 'weather', 'kinda', 'thin_hair', 'long', 'hair', 'volume', 'least', 'easy', 'handle', 'take', 'every', 'kind', 'shape', 'light', 'weight', 'hair', 'usually', 'seem', 'insane', 'hair', 'hair_straight_wavy', 'caothic', 'pony', 'tail', 'shaped', 'never', 'curly', 'iron', 'sometimes', 'look', 'black', 'actually', 'brown_green', 'shade', 'nose', 'kinda', 'northern', 'type', 'thin', 'long', 'bump', 'middle', 'nosebridge', 'freckle', 'summer', 'neanderthal_23andme_customer', 'physically', 'late_bloomer', 'first', 'period', 'half', 'year', 'always', 'looked', 'year_younger', 'actual', 'also', 'adult', 'people', 'think', '22-25', 'year', 'parent', 'late_bloomer', 'think', 'genetics', 'hereditary', 'lactose_intolerance', 'like', 'father', 'parent', 'thin', 'bone', 'bone', 'rather', 'elastic', 'never', 'broke', '1.61', 'inch_tall', 'weight', 'pound', 'average', 'currently', 'pear', 'shape', 'skinny', 'upper_body', 'average', 'sized', 'boob', 'thick', 'booty', 'thigh', 'without', 'african', 'brachydactyly', 'type', 'mother', 'mother', 'well', 'blood_type', 'father', 'mother', 'high', 'according_study', 'mensa', 'something', '130+', 'analytic', 'emotional', 'strong', 'sixth_sense', 'overwhelmed', 'emotion', 'surrounding', 'know', 'genetic_trait', 'sometimes', 'experience', 'telepathy', 'even', 'believe', 'actually', 'rational', 'person', 'know', 'limit', 'knowledge', 'think', 'telepathy', 'could', 'evolutionary', 'trait', 'surviving', 'talk', 'hope', 'interesting', 'nice']","['hungarian', 'magyar', 'person']"
50464,pavloviandogg,2018-09-20 02:14:38,9hbdsw,13,/r/23andme/comments/9hbdsw/results_say_im_not_lactose_intolerant_but/,1,Results say I'm not lactose intolerant but...,"I got my results back yesterday. They say I'm not lactose intolerant BUT I have a really hard time digesting dairy without a lactaid. Both my mom and sister also can't eat dairy. I found this out by doing a full elimination diet where I also cut out gluten, soy, and a few other common food intolerances. Without being too graphic, I have pretty terrible diarrhea anytime I introduce dairy back into my diet without a lactaid. The only other thing that gives me close to the same indigestion is red meat, and even then it makes me only gassy.

Has anyone else tested negative for lactose intolerance? Or do they know of another gene or mechanism that can lead to lactose intolerance?",23andme,"['result', 'back', 'yesterday', 'lactose', 'intolerant', 'really', 'hard', 'time', 'digesting', 'dairy', 'without', 'lactaid', 'sister', 'also', 'dairy', 'found', 'full', 'elimination', 'diet', 'also', 'gluten', 'common', 'food', 'intolerance', 'without', 'graphic', 'pretty', 'terrible', 'diarrhea', 'anytime', 'introduce', 'dairy', 'back', 'diet', 'without', 'lactaid', 'thing', 'give', 'close', 'indigestion', 'meat', 'even', 'make', 'gassy', 'anyone', 'else', 'tested', 'negative', 'lactose', 'intolerance', 'know', 'another', 'gene', 'mechanism', 'lead', 'lactose', 'intolerance']","['result', 'lactose', 'intolerant']","['result', 'back', 'yesterday', 'lactose_intolerant', 'really', 'hard_time', 'digesting', 'dairy', 'without', 'lactaid', 'sister', 'also', 'dairy', 'found', 'full', 'elimination', 'diet', 'also', 'gluten', 'common', 'food', 'intolerance', 'without', 'graphic', 'pretty', 'terrible', 'diarrhea', 'anytime', 'introduce', 'dairy', 'back', 'diet', 'without', 'lactaid', 'thing', 'give', 'close', 'indigestion', 'meat', 'even', 'make', 'gassy', 'anyone_else', 'tested_negative', 'lactose_intolerance', 'know', 'another', 'gene', 'mechanism', 'lead', 'lactose_intolerance']","['result', 'lactose_intolerant']"
51921,KoolNerdz,2018-06-17 22:21:14,8rujco,4,/r/23andme/comments/8rujco/im_lactose_intolerant_but_i_eat_dairy_fine/,0,I’m lactose intolerant but I eat dairy fine.,"So one of the wellness reports for Lactose Intolerant, it said I’m intolerant which is weird because I eat cheese and other dairy fine without any symptoms. Could this be noise or a misinformation? I still don’t understand why I’m intolerant to lactose products.",23andme,"['wellness', 'report', 'lactose', 'intolerant', 'said', 'intolerant', 'weird', 'cheese', 'dairy', 'fine', 'without', 'symptom', 'could', 'noise', 'misinformation', 'still', 'understand', 'intolerant', 'lactose', 'product']","['lactose', 'intolerant', 'dairy', 'fine']","['wellness_report', 'lactose_intolerant', 'said', 'intolerant', 'weird', 'cheese', 'dairy', 'fine', 'without', 'symptom', 'could', 'noise', 'misinformation', 'still', 'understand', 'intolerant', 'lactose', 'product']","['lactose_intolerant', 'dairy', 'fine']"
