,author,created_utc,body,id,parent_id,permalink,score,subreddit,body_clean,body_ngrams
14347,jareader,2022-07-28 18:56:57,"""A group of scientists has concluded that ancient Europeans drank milk for millennia despite the digestive problems it may have caused, casting doubt on theories on how humans evolved to tolerate it.  
Scientists have long speculated that an enzyme needed to avoid any gastrointestinal discomfort developed rapidly in populations where domesticating dairy animals was prevalent.  
People who could tolerate milk, that theory goes, gained a new source of calories and protein and passed on their genes to more healthy offspring than those without the genetic trait — known as lactase persistence — that allows them to digest the sugar in milk into adulthood.  
But a new study has offered a radically different theory, arguing that side effects such as gas, bloating and intestinal cramps weren’t enough on their own to move the evolutionary needle on the genetic mutation.

“Prehistoric people in Europe may have started consuming milk from domesticated animals thousands of years before they evolved the gene to digest it,” the study’s authors said.  
The study, published in the journal Nature, was produced in collaboration with more than 100 scientists across a range of fields including genetics, archaeology and epidemiology. The scientists mapped out estimated milk consumption in Europe from approximately 9,000 years ago to 500 years ago.  
By analyzing animal fat residues in pottery from hundreds of archaeological sites, alongside DNA samples harvested from ancient skeletons, the researchers concluded that lactase persistence was not common until around 1,000 B.C., nearly 4,000 years after it was first detected.  
And, rather than in times of abundance, they argue that it was during famine and epidemics that having the mutation became critical to survival: when undigested lactose could lead to serious intestinal illnesses and death.

Using archaeological records to identify periods where populations shrank, they concluded that people were more likely to drink milk when all other food sources had been exhausted, and that during those periods, diarrhea was more likely to escalate from a mild to a deadly condition.  
George Davey Smith, an epidemiologist at the University of Bristol, who teamed up with the researchers on an analysis of contemporary data on milk and lactase persistence in current populations, said the study raises “fascinating questions” about whether some people who believe they are lactose intolerant “might actually be fine if they drank milk.”  
About a quarter of Americans are lactose intolerant. In a lawsuit filed last year, a group of American doctors asked why the U.S. Department of Agriculture’s dietary guidelines recommend so much dairy — suggesting that the federal agency is looking out for the interests of the meat and dairy industries rather than the health of Americans.""",ii0yqam,t3_wai165,/r/lactoseintolerant/comments/wai165/ancient_europeans_were_lactose_intolerant_they/ii0yqam/,1,lactoseintolerant,"['group', 'scientist', 'concluded', 'ancient', 'european', 'drank', 'milk', 'millennium', 'despite', 'digestive', 'problem', 'caused', 'casting', 'doubt', 'theory', 'human', 'evolved', 'tolerate', 'scientist', 'long', 'speculated', 'enzyme', 'needed', 'avoid', 'gastrointestinal', 'discomfort', 'developed', 'rapidly', 'population', 'domesticating', 'dairy', 'animal', 'prevalent', 'people', 'could', 'tolerate', 'milk', 'theory', 'gained', 'source', 'calorie', 'protein', 'passed', 'gene', 'healthy', 'offspring', 'without', 'genetic', 'trait', 'known', 'lactase', 'persistence', 'allows', 'digest', 'sugar', 'milk', 'adulthood', 'study', 'offered', 'radically', 'different', 'theory', 'arguing', 'side', 'effect', 'bloating', 'intestinal', 'cramp', 'enough', 'move', 'evolutionary', 'needle', 'genetic', 'mutation', 'prehistoric', 'people', 'europe', 'started', 'consuming', 'milk', 'domesticated', 'animal', 'thousand', 'year', 'evolved', 'gene', 'digest', 'study', 'author', 'said', 'study', 'published', 'journal', 'nature', 'produced', 'collaboration', 'scientist', 'across', 'range', 'field', 'including', 'genetics', 'archaeology', 'epidemiology', 'scientist', 'mapped', 'estimated', 'milk', 'consumption', 'europe', 'approximately', '9,000', 'year', 'year', 'analyzing', 'animal', 'residue', 'pottery', 'hundred', 'archaeological', 'site', 'alongside', 'sample', 'harvested', 'ancient', 'skeleton', 'researcher', 'concluded', 'lactase', 'persistence', 'common', 'around', '1,000', 'b.c.', 'nearly', '4,000', 'year', 'first', 'detected', 'rather', 'time', 'abundance', 'argue', 'famine', 'epidemic', 'mutation', 'became', 'critical', 'survival', 'undigested', 'lactose', 'could', 'lead', 'serious', 'intestinal', 'illness', 'death', 'using', 'archaeological', 'record', 'identify', 'period', 'population', 'shrank', 'concluded', 'people', 'likely', 'drink', 'milk', 'food', 'source', 'exhausted', 'period', 'diarrhea', 'likely', 'escalate', 'mild', 'deadly', 'condition', 'george', 'davey', 'smith', 'epidemiologist', 'university', 'bristol', 'teamed', 'researcher', 'analysis', 'contemporary', 'data', 'milk', 'lactase', 'persistence', 'current', 'population', 'said', 'study', 'raise', 'fascinating', 'question', 'whether', 'people', 'believe', 'lactose', 'intolerant', 'might', 'actually', 'fine', 'drank', 'milk.', 'quarter', 'american', 'lactose', 'intolerant', 'lawsuit', 'filed', 'last', 'year', 'group', 'american', 'doctor', 'asked', 'u.s.', 'department', 'agriculture', 'dietary', 'guideline', 'recommend', 'much', 'dairy', 'suggesting', 'federal', 'agency', 'looking', 'interest', 'meat', 'dairy', 'industry', 'rather', 'health', 'american']","['group', 'scientist', 'concluded', 'ancient', 'european', 'drank', 'milk', 'millennium', 'despite', 'digestive', 'problem', 'caused', 'casting', 'doubt', 'theory', 'human_evolved', 'tolerate', 'scientist', 'long', 'speculated', 'enzyme', 'needed', 'avoid', 'gastrointestinal', 'discomfort', 'developed', 'rapidly', 'population', 'domesticating', 'dairy', 'animal', 'prevalent', 'people', 'could', 'tolerate', 'milk', 'theory', 'gained', 'source', 'calorie', 'protein', 'passed', 'gene', 'healthy', 'offspring', 'without', 'genetic_trait', 'known', 'lactase_persistence', 'allows', 'digest', 'sugar', 'milk', 'adulthood', 'study', 'offered', 'radically_different', 'theory', 'arguing', 'side', 'effect', 'bloating', 'intestinal', 'cramp', 'enough', 'move', 'evolutionary', 'needle', 'genetic_mutation', 'prehistoric', 'people', 'europe', 'started', 'consuming', 'milk', 'domesticated', 'animal', 'thousand_year', 'evolved', 'gene', 'digest', 'study', 'author', 'said', 'study_published', 'journal_nature', 'produced', 'collaboration', 'scientist', 'across', 'range', 'field', 'including', 'genetics', 'archaeology', 'epidemiology', 'scientist', 'mapped', 'estimated', 'milk', 'consumption', 'europe', 'approximately', '9,000_year', 'year', 'analyzing', 'animal', 'residue', 'pottery', 'hundred', 'archaeological_site', 'alongside', 'sample', 'harvested', 'ancient', 'skeleton', 'researcher', 'concluded', 'lactase_persistence', 'common', 'around', '1,000', 'b.c.', 'nearly', '4,000_year', 'first', 'detected', 'rather', 'time', 'abundance', 'argue', 'famine', 'epidemic', 'mutation', 'became', 'critical', 'survival', 'undigested', 'lactose', 'could', 'lead', 'serious', 'intestinal', 'illness', 'death', 'using', 'archaeological', 'record', 'identify', 'period', 'population', 'shrank', 'concluded', 'people', 'likely', 'drink_milk', 'food', 'source', 'exhausted', 'period', 'diarrhea', 'likely', 'escalate', 'mild', 'deadly', 'condition', 'george', 'davey', 'smith', 'epidemiologist', 'university', 'bristol', 'teamed', 'researcher', 'analysis', 'contemporary', 'data', 'milk', 'lactase_persistence', 'current', 'population', 'said', 'study', 'raise', 'fascinating', 'question_whether', 'people', 'believe', 'lactose_intolerant', 'might', 'actually', 'fine', 'drank', 'milk.', 'quarter', 'american', 'lactose_intolerant', 'lawsuit', 'filed', 'last_year', 'group', 'american', 'doctor', 'asked', 'u.s.', 'department', 'agriculture', 'dietary', 'guideline', 'recommend', 'much', 'dairy', 'suggesting', 'federal', 'agency', 'looking', 'interest', 'meat', 'dairy', 'industry', 'rather', 'health', 'american']"
14750,Shimerald,2022-07-15 13:21:00,"Well, I can tell you your experience is not uncommon, and part of the reason for it. As babies,  we need to be able to digest milk when nursing, but aren't supposed to need to keep drinking milk after we get older. The body just slowly stops ""wasting"" energy on producing the enzyme it shouldn't need (ha). This is why many people can have dairy when they are younger, but as they get older they can't. Some people got a lucky mutation where their body never stops producing lactase and they passed that gene down enough that it's as or more common than lactose intolerance.

At the moment, your body is still producing some enzymes, but not enough for high lactose products, and it's sadly not uncommon for it to get worse over time. This is likely why you can still have some cheese or why froyo didn't seem to upset you. Cheese and yogurt naturally have less lactose due to aging, and some brands apparently process out lactose from their cheese as part of their production process. Generally, if a dairy product has cultures and has been aged, it has less lactose per serving, and many severe LI people can have sharp cheeses without issues. 

As a side note, since you are just figuring out you are LI, start practicing the habit of reading labels. Milk, whey, and even straight up lactose are often added as fillers in random stuff. Also, be wary of ""whey"" as it's apparently 99% lactose, or something like that. Don't let anyone make you a protein smoothie or shake with a whey powder mix, as it will likely destroy you.

Best of luck figuring out what you can and can't have and finding what lactose free things are available near you.",ig9eaw2,t3_vzj5we,/r/lactoseintolerant/comments/vzj5we/newly_lactose_intolerant_i_guess/ig9eaw2/,1,lactoseintolerant,"['well', 'tell', 'experience', 'uncommon', 'part', 'reason', 'baby', 'need', 'able', 'digest', 'milk', 'nursing', 'supposed', 'need', 'keep', 'drinking', 'milk', 'older', 'body', 'slowly', 'stop', 'wasting', 'energy', 'producing', 'enzyme', 'need', 'many', 'people', 'dairy', 'younger', 'older', 'people', 'lucky', 'mutation', 'body', 'never', 'stop', 'producing', 'lactase', 'passed', 'gene', 'enough', 'common', 'lactose', 'intolerance', 'moment', 'body', 'still', 'producing', 'enzyme', 'enough', 'high', 'lactose', 'product', 'sadly', 'uncommon', 'worse', 'time', 'likely', 'still', 'cheese', 'froyo', 'seem', 'upset', 'cheese', 'yogurt', 'naturally', 'lactose', 'aging', 'brand', 'apparently', 'process', 'lactose', 'cheese', 'part', 'production', 'process', 'generally', 'dairy', 'product', 'culture', 'aged', 'lactose', 'serving', 'many', 'severe', 'people', 'sharp', 'cheese', 'without', 'issue', 'side', 'note', 'since', 'figuring', 'start', 'practicing', 'habit', 'reading', 'label', 'milk', 'whey', 'even', 'straight', 'lactose', 'often', 'added', 'filler', 'random', 'stuff', 'also', 'wary', 'whey', 'apparently', 'lactose', 'something', 'like', 'anyone', 'make', 'protein', 'smoothie', 'shake', 'whey', 'powder', 'likely', 'destroy', 'best', 'luck', 'figuring', 'finding', 'lactose', 'free', 'thing', 'available', 'near']","['well', 'tell', 'experience', 'uncommon', 'part', 'reason', 'baby', 'need', 'able', 'digest', 'milk', 'nursing', 'supposed', 'need', 'keep', 'drinking', 'milk', 'older', 'body', 'slowly', 'stop_wasting', 'energy', 'producing', 'enzyme', 'need', 'many', 'people', 'dairy', 'younger', 'older', 'people', 'lucky', 'mutation', 'body', 'never', 'stop', 'producing', 'lactase', 'passed', 'gene', 'enough', 'common', 'lactose_intolerance', 'moment', 'body', 'still', 'producing', 'enzyme', 'enough', 'high', 'lactose', 'product', 'sadly', 'uncommon', 'worse', 'time', 'likely', 'still', 'cheese', 'froyo', 'seem', 'upset', 'cheese', 'yogurt', 'naturally', 'lactose', 'aging', 'brand', 'apparently', 'process', 'lactose', 'cheese', 'part', 'production', 'process', 'generally', 'dairy_product', 'culture', 'aged', 'lactose', 'serving', 'many', 'severe', 'people', 'sharp', 'cheese', 'without', 'issue', 'side_note', 'since', 'figuring', 'start', 'practicing', 'habit', 'reading', 'label', 'milk', 'whey', 'even', 'straight', 'lactose', 'often', 'added', 'filler', 'random', 'stuff', 'also', 'wary', 'whey', 'apparently', 'lactose', 'something', 'like', 'anyone', 'make', 'protein', 'smoothie', 'shake', 'whey', 'powder', 'likely', 'destroy', 'best_luck', 'figuring', 'finding', 'lactose', 'free', 'thing', 'available', 'near']"
15477,sugoiirex,2022-06-20 18:14:19,I am only saying I’m intolerant because I got my results form a gene test todays that says I’m lactose intolerant also when I throw up and stuff it’s not comparable to food poisoning or something it’s like non stop cramps and it never happened when I drank milk or something I consumed that all my life without ever experiencing symptoms of lactose intolerance,id34kjw,t1_id30vju,/r/lactoseintolerant/comments/vgg5eo/serious_illness_through_lactose_intolerance/id34kjw/,1,lactoseintolerant,"['saying', 'intolerant', 'result', 'form', 'gene', 'test', 'today', 'lactose', 'intolerant', 'also', 'throw', 'stuff', 'comparable', 'food', 'poisoning', 'something', 'like', 'stop', 'cramp', 'never', 'happened', 'drank', 'milk', 'something', 'consumed', 'life', 'without', 'ever', 'experiencing', 'symptom', 'lactose', 'intolerance']","['saying', 'intolerant', 'result', 'form', 'gene', 'test', 'today', 'lactose_intolerant', 'also', 'throw', 'stuff', 'comparable', 'food', 'poisoning', 'something', 'like', 'stop', 'cramp', 'never', 'happened', 'drank', 'milk', 'something', 'consumed', 'life', 'without', 'ever', 'experiencing', 'symptom', 'lactose_intolerance']"
15570,Fred1894,2022-06-16 16:06:10,"The original point of cheese was to break down the lactose in cow's milk in order to make a palatable food for humans. Nowadays many people have a gene to cleave lactose in their guts. People have been making cheese since sometime before history began, but this gene only became widespread in Europe in the second Millennium. We're the normal ones; people who put dairy on everything are mutants. 😁",iclh751,t3_vdofk3,/r/lactoseintolerant/comments/vdofk3/why_do_milk_ice_cream_and_cream_cheese_mess_me_up/iclh751/,1,lactoseintolerant,"['original', 'point', 'cheese', 'break', 'lactose', 'milk', 'order', 'make', 'palatable', 'food', 'human', 'nowadays', 'many', 'people', 'gene', 'cleave', 'lactose', 'people', 'making', 'cheese', 'since', 'sometime', 'history', 'began', 'gene', 'became', 'widespread', 'europe', 'second', 'millennium', 'normal', 'people', 'dairy', 'everything', 'mutant']","['original', 'point', 'cheese', 'break', 'lactose', 'milk', 'order', 'make', 'palatable', 'food', 'human', 'nowadays', 'many', 'people', 'gene', 'cleave', 'lactose', 'people', 'making', 'cheese', 'since', 'sometime', 'history', 'began', 'gene', 'became_widespread', 'europe', 'second', 'millennium', 'normal', 'people', 'dairy', 'everything', 'mutant']"
16802,Shimerald,2022-05-02 17:14:10,"Oh man, I feel you. I've heard lactose intolerance is typically genetic and is actually bad more dominant gene. I got mine from my Dad and he found out in the last few years he's ALSO Celiac. My brother and his daughter got tested and have Celiac as well (but luckily not the LI). I'm pretty sure I've got celiac (but haven't been tested yet) as my husband has it, so I don't eat it at home anymore, and I've noticed I get sick if I have wheat when I eat out.

Hang in there!",i71tfw6,t1_i71rrhi,/r/lactoseintolerant/comments/ugimr6/i_cant_even_eat_out_and_lactase_pills_dont_work/i71tfw6/,1,lactoseintolerant,"['feel', 'heard', 'lactose', 'intolerance', 'typically', 'genetic', 'actually', 'dominant', 'gene', 'mine', 'found', 'last', 'year', 'also', 'celiac', 'brother', 'daughter', 'tested', 'celiac', 'well', 'luckily', 'pretty', 'sure', 'celiac', 'tested', 'husband', 'home', 'anymore', 'noticed', 'sick', 'wheat', 'hang']","['feel', 'heard', 'lactose_intolerance', 'typically', 'genetic', 'actually', 'dominant_gene', 'mine', 'found', 'last_year', 'also', 'celiac', 'brother', 'daughter', 'tested', 'celiac', 'well', 'luckily', 'pretty_sure', 'celiac', 'tested', 'husband', 'home', 'anymore', 'noticed', 'sick', 'wheat', 'hang']"
17720,bebestonline,2022-04-08 19:16:50,"Sorry to hear you have ibs but hope that knowing what the real problem is helps to keep your stomach happy.     
   
   
Btw, it's also possible that you didn't get it through hereditary means and that you were just unlucky with a random gene mutation in early development.",i3xu4pp,t3_txax1n,/r/lactoseintolerant/comments/txax1n/oh_ok_then/i3xu4pp/,1,lactoseintolerant,"['sorry', 'hear', 'hope', 'knowing', 'real', 'problem', 'help', 'keep', 'stomach', 'happy', 'also', 'possible', 'hereditary', 'mean', 'unlucky', 'random', 'gene', 'mutation', 'early', 'development']","['sorry_hear_hope', 'knowing', 'real', 'problem', 'help', 'keep', 'stomach', 'happy', 'also', 'possible', 'hereditary', 'mean', 'unlucky', 'random', 'gene_mutation', 'early', 'development']"
18404,Competitive-Isopod74,2022-03-23 00:37:50,"We have auto immune issues in our family as well. I have the genes and borderline titers now, but no major symptoms. I told my daughter's pediatrician(who has also developed sudden severe lactose intolerance-recently diagnosed after 6 months of daily vomiting) testing her for autoimmune issues is our next step. We are going see an infectious disease expert tomorrow!",i1qhc6s,t1_hs73kdp,/r/lactoseintolerant/comments/s0z2q7/lactose_intolerance_as_part_of_long_covid/i1qhc6s/,1,lactoseintolerant,"['auto', 'immune', 'issue', 'family', 'well', 'gene', 'borderline', 'titer', 'major', 'symptom', 'told', 'daughter', 'pediatrician', 'also', 'developed', 'sudden', 'severe', 'lactose', 'intolerance-recently', 'diagnosed', 'month', 'daily', 'vomiting', 'testing', 'autoimmune', 'issue', 'next', 'step', 'going', 'infectious', 'disease', 'expert', 'tomorrow']","['auto_immune', 'issue', 'family', 'well', 'gene', 'borderline', 'titer', 'major', 'symptom', 'told', 'daughter', 'pediatrician', 'also', 'developed', 'sudden', 'severe', 'lactose', 'intolerance-recently', 'diagnosed', 'month', 'daily', 'vomiting', 'testing', 'autoimmune', 'issue', 'next_step', 'going', 'infectious', 'disease', 'expert', 'tomorrow']"
18808,TheSunflowerSeeds,2022-03-07 02:21:18,"If there are no Bees around, or other pollinators, self-pollination is an option. It isn’t ideal for the gene pool, but the seeds in the center of the flower can do this in order to pollinate. So having the ability to be both male and female at least ensures greater survival of the sunflower.",hznjwh3,t1_hznjv4l,/r/lactoseintolerant/comments/igtk4p/i_love_oatlybut_i_think_its_causing_weight_gain/hznjwh3/,1,lactoseintolerant,"['around', 'pollinator', 'self-pollination', 'option', 'ideal', 'gene', 'pool', 'seed', 'center', 'flower', 'order', 'pollinate', 'ability', 'male', 'female', 'least', 'ensures', 'greater', 'survival', 'sunflower']","['around', 'pollinator', 'self-pollination', 'option', 'ideal', 'gene_pool', 'seed', 'center', 'flower', 'order', 'pollinate', 'ability', 'male_female', 'least', 'ensures', 'greater', 'survival', 'sunflower']"
19042,HydraBR,2022-02-26 23:42:19,"The gene was always there ""triggered"", it didn't triggered randomly.

 If you stop eating dairy your gut bacterias that help you breakdown dairy will die and your body will have to deal with lactose on your own.",hyksxv6,t1_hykh3q0,/r/lactoseintolerant/comments/t24jnl/what_did_i_do_to_deserve_this/hyksxv6/,3,lactoseintolerant,"['gene', 'always', 'triggered', 'triggered', 'randomly', 'stop', 'eating', 'dairy', 'bacteria', 'help', 'breakdown', 'dairy', 'body', 'deal', 'lactose']","['gene', 'always', 'triggered', 'triggered', 'randomly', 'stop', 'eating', 'dairy', 'bacteria', 'help', 'breakdown', 'dairy', 'body', 'deal', 'lactose']"
19045,RazieLynn,2022-02-26 22:16:54,"It's actually our genetics that is triggered when we stop drinking milk. As a species we are not meant to continue to drink milk after being weaned from breat milk, however as a society that uses cows as an source of milk for the extra fat, which use to be incredibly important to survive.

Now if we avoid milk or some times even randomly overnight, this gene can be triggered.  I wasn't lactose intolerant until about 28 years old when I was living with a roommate that was intolerant.",hykh3q0,t1_hyk2x7v,/r/lactoseintolerant/comments/t24jnl/what_did_i_do_to_deserve_this/hykh3q0/,6,lactoseintolerant,"['actually', 'genetics', 'triggered', 'stop', 'drinking', 'milk', 'specie', 'meant', 'continue', 'drink', 'milk', 'weaned', 'breat', 'milk', 'however', 'society', 'source', 'milk', 'extra', 'incredibly', 'important', 'survive', 'avoid', 'milk', 'time', 'even', 'randomly', 'overnight', 'gene', 'triggered', 'lactose', 'intolerant', 'year', 'living', 'roommate', 'intolerant']","['actually', 'genetics', 'triggered', 'stop', 'drinking', 'milk', 'specie', 'meant', 'continue', 'drink_milk', 'weaned', 'breat', 'milk', 'however', 'society', 'source', 'milk', 'extra', 'incredibly', 'important', 'survive', 'avoid', 'milk', 'time', 'even', 'randomly', 'overnight', 'gene', 'triggered', 'lactose_intolerant', 'year', 'living', 'roommate', 'intolerant']"
19098,KaneHau,2022-02-25 15:17:12,"Just so you know, LI is a genetic change in your body. Your genes which are responsible for handing it switched off (that's why it can happen quickly).

This is normal (7 out of 10 people world wide are somewhat to fully LI).",hye08xe,t1_hydsp12,/r/lactoseintolerant/comments/t151p3/is_it_possible_to_suddenly_become_lactose/hye08xe/,2,lactoseintolerant,"['know', 'genetic', 'change', 'body', 'gene', 'responsible', 'handing', 'switched', 'happen', 'quickly', 'normal', 'people', 'world', 'wide', 'somewhat', 'fully']","['know', 'genetic', 'change', 'body', 'gene_responsible', 'handing', 'switched', 'happen', 'quickly', 'normal', 'people', 'world_wide', 'somewhat', 'fully']"
19582,GodofPizza,2022-02-06 17:23:30,"Not a doctor, but my take is definitely yes. 

Lactose intolerance is a result of your body not producing enough lactase enzyme, which is a molecule human cells can make, to break up lactose sugars you eat. Most humans start out being able to make enough of it to be able to digest any lactose they might come across. Did you know human breast milk is 7% lactose? 

As we grow up, most people eventually become lactose intolerant. But I think it’s a spectrum. My theory is that our body’s ability to make lactase isn’t an on/off switch but a dimmer. We all have that one friend who is LI but just “toughs it out”. Among my family, we range from “I can eat some lactose products sometimes” to “it’s not ok even if I eat all the lactase pills”. And we share most of the same genes.",hvu0erf,t3_sm1c0w,/r/lactoseintolerant/comments/sm1c0w/is_it_possible_to_become_more_and_more_lactose/hvu0erf/,1,lactoseintolerant,"['doctor', 'take', 'definitely', 'lactose', 'intolerance', 'result', 'body', 'producing', 'enough', 'lactase', 'enzyme', 'molecule', 'human', 'cell', 'make', 'break', 'lactose', 'sugar', 'human', 'start', 'able', 'make', 'enough', 'able', 'digest', 'lactose', 'might', 'come', 'across', 'know', 'human', 'breast', 'milk', 'lactose', 'grow', 'people', 'eventually', 'become', 'lactose', 'intolerant', 'think', 'spectrum', 'theory', 'body', 'ability', 'make', 'lactase', 'on/off', 'switch', 'dimmer', 'friend', 'tough', 'among', 'family', 'range', 'lactose', 'product', 'sometimes', 'even', 'lactase', 'pill', 'share', 'gene']","['doctor', 'take', 'definitely', 'lactose_intolerance', 'result', 'body', 'producing', 'enough', 'lactase', 'enzyme', 'molecule', 'human', 'cell', 'make', 'break', 'lactose', 'sugar', 'human', 'start', 'able', 'make', 'enough', 'able', 'digest', 'lactose', 'might', 'come_across', 'know', 'human', 'breast', 'milk', 'lactose', 'grow', 'people', 'eventually_become', 'lactose_intolerant', 'think', 'spectrum', 'theory', 'body', 'ability', 'make', 'lactase', 'on/off', 'switch', 'dimmer', 'friend', 'tough', 'among', 'family', 'range', 'lactose', 'product', 'sometimes', 'even', 'lactase', 'pill', 'share', 'gene']"
