,author,created_utc,body,id,parent_id,permalink,score,subreddit,body_clean,body_ngrams
2437,beeskneecaps,2022-08-15 10:06:24,"Yeah this tracks for me. 15 yrs LI, I can't have butter at all and use earth balance instead. Plot twist is that I'm in great shape after cutting out products with lactose.

Starbucks (Nestle unfortunately) makes a solid lactose free coffee creamer.

Ben and Jerry's and many others make great ice creams. When eating out at restaurants, opt for gelatos.

Eggs with the yolk are just a recipe for sulfer stank, so I try to play those safely.

Anywho, good luck waiting for gene therapy",ikd4trh,t3_wore2j,/r/lactoseintolerant/comments/wore2j/anyones_li_progressively_get_worse/ikd4trh/,1,lactoseintolerant,"['yeah', 'track', 'butter', 'earth', 'balance', 'instead', 'plot', 'twist', 'great', 'shape', 'cutting', 'product', 'lactose', 'starbucks', 'nestle', 'unfortunately', 'make', 'solid', 'lactose', 'free', 'coffee', 'creamer', 'jerry', 'many', 'others', 'make', 'great', 'cream', 'eating', 'restaurant', 'gelatos', 'yolk', 'recipe', 'sulfer', 'stank', 'play', 'safely', 'anywho', 'good', 'luck', 'waiting', 'gene', 'therapy']","['yeah', 'track', 'butter', 'earth', 'balance', 'instead', 'plot_twist', 'great', 'shape', 'cutting', 'product', 'lactose', 'starbucks', 'nestle', 'unfortunately', 'make', 'solid', 'lactose', 'free', 'coffee', 'creamer', 'jerry', 'many', 'others', 'make', 'great', 'cream', 'eating', 'restaurant', 'gelatos', 'yolk', 'recipe', 'sulfer', 'stank', 'play', 'safely', 'anywho', 'good_luck', 'waiting', 'gene', 'therapy']"
2461,KaneHau,2022-08-14 17:44:43,"Yes.  That is how it happens for most people.  Happened to me when I turned 21.  Like a light switch, went from no problem to total problems in a matter of days.

It's your genes switching off.

Remember, it's normal.  7 out of 10 people world wide have lactose sensitivity.",ika1a1e,t3_woc1pc,/r/lactoseintolerant/comments/woc1pc/is_it_possible_to_become_lactose_intolerant/ika1a1e/,1,lactoseintolerant,"['happens', 'people', 'happened', 'turned', 'like', 'light', 'switch', 'went', 'problem', 'total', 'problem', 'matter', 'gene', 'switching', 'remember', 'normal', 'people', 'world', 'wide', 'lactose', 'sensitivity']","['happens', 'people', 'happened', 'turned', 'like', 'light', 'switch', 'went', 'problem', 'total', 'problem', 'matter', 'gene', 'switching', 'remember', 'normal', 'people', 'world_wide', 'lactose', 'sensitivity']"
2727,Shimerald,2022-08-06 13:10:05,"So, basically the body produces the lactase enzyme as a baby so it can digest the mother's milk (which has lactose in it) while breastfeeding. Theoretically, after you stop nursing, there isn't a real reason to keep producing the enzyme so your body goes ""let's not waste our energy making useless enzymes"" and stops making it. This is why many people develop it young.

However, there's a mutation ages from ago where the body keeps producing it through life. The theory is this was so beneficial to survival with all the calories and nutrients of dairy products that, despite the gene being more recessive, it's as or more common to be able to digest dairy. It's also more or less common to be lactose intolerant depending on your ethnic heritage, I believe. We got the old genetics, and everyone else got the lucky genetics.

As to your other questions, just tell your doctor the symptoms with dairy and that you think you have lactose intolerance. There are actually a couple tests to confirm if you want to be sure. However, many of us just figured it out with a combination of elimination diets, trying regular vs lactose free products,v and taking lactase enzymes and seeing if they helped or eliminated our symptoms.

I had the extra insight that my father had been highly lactose intolerant my whole life. So when I started noticing issues in high school, it didn't take long to figure it out. Try some lactose free milk (although I wouldn't start with Fairlife, as many people seem to still react to it) and see if it bothers you. You can also try to find some lactase enzymes and see if they help. Just be aware, they can be less effective over time if you get more severe, and some people take way more than the one pill suggested. 

Sorry you joined our sad club, but know we are here to help you figure out what you can eat and how to navigate avoiding dairy.",ij6jq7h,t1_ij60zl0,/r/lactoseintolerant/comments/whjxcw/i_think_i_might_be_lactose_intolerant_or_am_i/ij6jq7h/,1,lactoseintolerant,"['basically', 'body', 'produce', 'lactase', 'enzyme', 'baby', 'digest', 'mother', 'milk', 'lactose', 'breastfeeding', 'theoretically', 'stop', 'nursing', 'real', 'reason', 'keep', 'producing', 'enzyme', 'body', 'waste', 'energy', 'making', 'useless', 'enzyme', 'stop', 'making', 'many', 'people', 'develop', 'young', 'however', 'mutation', 'body', 'keep', 'producing', 'life', 'theory', 'beneficial', 'survival', 'calorie', 'nutrient', 'dairy', 'product', 'despite', 'gene', 'recessive', 'common', 'able', 'digest', 'dairy', 'also', 'common', 'lactose', 'intolerant', 'depending', 'ethnic', 'heritage', 'believe', 'genetics', 'everyone', 'else', 'lucky', 'genetics', 'question', 'tell', 'doctor', 'symptom', 'dairy', 'think', 'lactose', 'intolerance', 'actually', 'couple', 'test', 'confirm', 'want', 'sure', 'however', 'many', 'figured', 'combination', 'elimination', 'diet', 'trying', 'regular', 'lactose', 'free', 'product', 'taking', 'lactase', 'enzyme', 'seeing', 'helped', 'eliminated', 'symptom', 'extra', 'insight', 'father', 'highly', 'lactose', 'intolerant', 'whole', 'life', 'started', 'noticing', 'issue', 'high', 'school', 'take', 'long', 'figure', 'lactose', 'free', 'milk', 'although', 'would', 'start', 'fairlife', 'many', 'people', 'seem', 'still', 'react', 'bother', 'also', 'find', 'lactase', 'enzyme', 'help', 'aware', 'effective', 'time', 'severe', 'people', 'take', 'pill', 'suggested', 'sorry', 'joined', 'club', 'know', 'help', 'figure', 'navigate', 'avoiding', 'dairy']","['basically', 'body', 'produce', 'lactase', 'enzyme', 'baby', 'digest', 'mother', 'milk', 'lactose', 'breastfeeding', 'theoretically', 'stop', 'nursing', 'real', 'reason', 'keep', 'producing', 'enzyme', 'body', 'waste_energy', 'making', 'useless', 'enzyme', 'stop_making', 'many', 'people', 'develop', 'young', 'however', 'mutation', 'body', 'keep', 'producing', 'life', 'theory', 'beneficial', 'survival', 'calorie', 'nutrient', 'dairy_product', 'despite', 'gene_recessive', 'common', 'able', 'digest', 'dairy', 'also', 'common', 'lactose_intolerant', 'depending', 'ethnic', 'heritage', 'believe', 'genetics', 'everyone_else', 'lucky', 'genetics', 'question', 'tell', 'doctor', 'symptom', 'dairy', 'think', 'lactose_intolerance', 'actually', 'couple', 'test', 'confirm', 'want', 'sure', 'however', 'many', 'figured', 'combination', 'elimination', 'diet', 'trying', 'regular', 'lactose', 'free', 'product', 'taking', 'lactase', 'enzyme', 'seeing', 'helped', 'eliminated', 'symptom', 'extra_insight', 'father', 'highly', 'lactose_intolerant', 'whole_life', 'started_noticing', 'issue', 'high_school', 'take', 'long', 'figure', 'lactose', 'free', 'milk', 'although', 'would', 'start', 'fairlife', 'many', 'people', 'seem', 'still', 'react', 'bother', 'also', 'find', 'lactase', 'enzyme', 'help', 'aware', 'effective', 'time', 'severe', 'people', 'take', 'pill', 'suggested', 'sorry', 'joined', 'club', 'know', 'help_figure', 'navigate', 'avoiding', 'dairy']"
3010,jareader,2022-07-28 18:56:57,"""A group of scientists has concluded that ancient Europeans drank milk for millennia despite the digestive problems it may have caused, casting doubt on theories on how humans evolved to tolerate it.  
Scientists have long speculated that an enzyme needed to avoid any gastrointestinal discomfort developed rapidly in populations where domesticating dairy animals was prevalent.  
People who could tolerate milk, that theory goes, gained a new source of calories and protein and passed on their genes to more healthy offspring than those without the genetic trait — known as lactase persistence — that allows them to digest the sugar in milk into adulthood.  
But a new study has offered a radically different theory, arguing that side effects such as gas, bloating and intestinal cramps weren’t enough on their own to move the evolutionary needle on the genetic mutation.

“Prehistoric people in Europe may have started consuming milk from domesticated animals thousands of years before they evolved the gene to digest it,” the study’s authors said.  
The study, published in the journal Nature, was produced in collaboration with more than 100 scientists across a range of fields including genetics, archaeology and epidemiology. The scientists mapped out estimated milk consumption in Europe from approximately 9,000 years ago to 500 years ago.  
By analyzing animal fat residues in pottery from hundreds of archaeological sites, alongside DNA samples harvested from ancient skeletons, the researchers concluded that lactase persistence was not common until around 1,000 B.C., nearly 4,000 years after it was first detected.  
And, rather than in times of abundance, they argue that it was during famine and epidemics that having the mutation became critical to survival: when undigested lactose could lead to serious intestinal illnesses and death.

Using archaeological records to identify periods where populations shrank, they concluded that people were more likely to drink milk when all other food sources had been exhausted, and that during those periods, diarrhea was more likely to escalate from a mild to a deadly condition.  
George Davey Smith, an epidemiologist at the University of Bristol, who teamed up with the researchers on an analysis of contemporary data on milk and lactase persistence in current populations, said the study raises “fascinating questions” about whether some people who believe they are lactose intolerant “might actually be fine if they drank milk.”  
About a quarter of Americans are lactose intolerant. In a lawsuit filed last year, a group of American doctors asked why the U.S. Department of Agriculture’s dietary guidelines recommend so much dairy — suggesting that the federal agency is looking out for the interests of the meat and dairy industries rather than the health of Americans.""",ii0yqam,t3_wai165,/r/lactoseintolerant/comments/wai165/ancient_europeans_were_lactose_intolerant_they/ii0yqam/,1,lactoseintolerant,"['group', 'scientist', 'concluded', 'ancient', 'european', 'drank', 'milk', 'millennium', 'despite', 'digestive', 'problem', 'caused', 'casting', 'doubt', 'theory', 'human', 'evolved', 'tolerate', 'scientist', 'long', 'speculated', 'enzyme', 'needed', 'avoid', 'gastrointestinal', 'discomfort', 'developed', 'rapidly', 'population', 'domesticating', 'dairy', 'animal', 'prevalent', 'people', 'could', 'tolerate', 'milk', 'theory', 'gained', 'source', 'calorie', 'protein', 'passed', 'gene', 'healthy', 'offspring', 'without', 'genetic', 'trait', 'known', 'lactase', 'persistence', 'allows', 'digest', 'sugar', 'milk', 'adulthood', 'study', 'offered', 'radically', 'different', 'theory', 'arguing', 'side', 'effect', 'bloating', 'intestinal', 'cramp', 'enough', 'move', 'evolutionary', 'needle', 'genetic', 'mutation', 'prehistoric', 'people', 'europe', 'started', 'consuming', 'milk', 'domesticated', 'animal', 'thousand', 'year', 'evolved', 'gene', 'digest', 'study', 'author', 'said', 'study', 'published', 'journal', 'nature', 'produced', 'collaboration', 'scientist', 'across', 'range', 'field', 'including', 'genetics', 'archaeology', 'epidemiology', 'scientist', 'mapped', 'estimated', 'milk', 'consumption', 'europe', 'approximately', '9,000', 'year', 'year', 'analyzing', 'animal', 'residue', 'pottery', 'hundred', 'archaeological', 'site', 'alongside', 'sample', 'harvested', 'ancient', 'skeleton', 'researcher', 'concluded', 'lactase', 'persistence', 'common', 'around', '1,000', 'b.c.', 'nearly', '4,000', 'year', 'first', 'detected', 'rather', 'time', 'abundance', 'argue', 'famine', 'epidemic', 'mutation', 'became', 'critical', 'survival', 'undigested', 'lactose', 'could', 'lead', 'serious', 'intestinal', 'illness', 'death', 'using', 'archaeological', 'record', 'identify', 'period', 'population', 'shrank', 'concluded', 'people', 'likely', 'drink', 'milk', 'food', 'source', 'exhausted', 'period', 'diarrhea', 'likely', 'escalate', 'mild', 'deadly', 'condition', 'george', 'davey', 'smith', 'epidemiologist', 'university', 'bristol', 'teamed', 'researcher', 'analysis', 'contemporary', 'data', 'milk', 'lactase', 'persistence', 'current', 'population', 'said', 'study', 'raise', 'fascinating', 'question', 'whether', 'people', 'believe', 'lactose', 'intolerant', 'might', 'actually', 'fine', 'drank', 'milk.', 'quarter', 'american', 'lactose', 'intolerant', 'lawsuit', 'filed', 'last', 'year', 'group', 'american', 'doctor', 'asked', 'u.s.', 'department', 'agriculture', 'dietary', 'guideline', 'recommend', 'much', 'dairy', 'suggesting', 'federal', 'agency', 'looking', 'interest', 'meat', 'dairy', 'industry', 'rather', 'health', 'american']","['group', 'scientist', 'concluded', 'ancient', 'european', 'drank', 'milk', 'millennium', 'despite', 'digestive', 'problem', 'caused', 'casting', 'doubt', 'theory', 'human_evolved', 'tolerate', 'scientist', 'long', 'speculated', 'enzyme', 'needed', 'avoid', 'gastrointestinal', 'discomfort', 'developed', 'rapidly', 'population', 'domesticating', 'dairy', 'animal', 'prevalent', 'people', 'could', 'tolerate', 'milk', 'theory', 'gained', 'source', 'calorie', 'protein', 'passed', 'gene', 'healthy', 'offspring', 'without', 'genetic_trait', 'known', 'lactase_persistence', 'allows', 'digest', 'sugar', 'milk', 'adulthood', 'study', 'offered', 'radically_different', 'theory', 'arguing', 'side', 'effect', 'bloating', 'intestinal', 'cramp', 'enough', 'move', 'evolutionary', 'needle', 'genetic_mutation', 'prehistoric', 'people', 'europe', 'started', 'consuming', 'milk', 'domesticated', 'animal', 'thousand_year', 'evolved', 'gene', 'digest', 'study', 'author', 'said', 'study_published', 'journal_nature', 'produced', 'collaboration', 'scientist', 'across', 'range', 'field', 'including', 'genetics', 'archaeology', 'epidemiology', 'scientist', 'mapped', 'estimated', 'milk', 'consumption', 'europe', 'approximately', '9,000_year', 'year', 'analyzing', 'animal', 'residue', 'pottery', 'hundred', 'archaeological_site', 'alongside', 'sample', 'harvested', 'ancient', 'skeleton', 'researcher', 'concluded', 'lactase_persistence', 'common', 'around', '1,000', 'b.c.', 'nearly', '4,000_year', 'first', 'detected', 'rather', 'time', 'abundance', 'argue', 'famine', 'epidemic', 'mutation', 'became', 'critical', 'survival', 'undigested', 'lactose', 'could', 'lead', 'serious', 'intestinal', 'illness', 'death', 'using', 'archaeological', 'record', 'identify', 'period', 'population', 'shrank', 'concluded', 'people', 'likely', 'drink_milk', 'food', 'source', 'exhausted', 'period', 'diarrhea', 'likely', 'escalate', 'mild', 'deadly', 'condition', 'george', 'davey', 'smith', 'epidemiologist', 'university', 'bristol', 'teamed', 'researcher', 'analysis', 'contemporary', 'data', 'milk', 'lactase_persistence', 'current', 'population', 'said', 'study', 'raise', 'fascinating', 'question_whether', 'people', 'believe', 'lactose_intolerant', 'might', 'actually', 'fine', 'drank', 'milk.', 'quarter', 'american', 'lactose_intolerant', 'lawsuit', 'filed', 'last_year', 'group', 'american', 'doctor', 'asked', 'u.s.', 'department', 'agriculture', 'dietary', 'guideline', 'recommend', 'much', 'dairy', 'suggesting', 'federal', 'agency', 'looking', 'interest', 'meat', 'dairy', 'industry', 'rather', 'health', 'american']"
3413,Shimerald,2022-07-15 13:21:00,"Well, I can tell you your experience is not uncommon, and part of the reason for it. As babies,  we need to be able to digest milk when nursing, but aren't supposed to need to keep drinking milk after we get older. The body just slowly stops ""wasting"" energy on producing the enzyme it shouldn't need (ha). This is why many people can have dairy when they are younger, but as they get older they can't. Some people got a lucky mutation where their body never stops producing lactase and they passed that gene down enough that it's as or more common than lactose intolerance.

At the moment, your body is still producing some enzymes, but not enough for high lactose products, and it's sadly not uncommon for it to get worse over time. This is likely why you can still have some cheese or why froyo didn't seem to upset you. Cheese and yogurt naturally have less lactose due to aging, and some brands apparently process out lactose from their cheese as part of their production process. Generally, if a dairy product has cultures and has been aged, it has less lactose per serving, and many severe LI people can have sharp cheeses without issues. 

As a side note, since you are just figuring out you are LI, start practicing the habit of reading labels. Milk, whey, and even straight up lactose are often added as fillers in random stuff. Also, be wary of ""whey"" as it's apparently 99% lactose, or something like that. Don't let anyone make you a protein smoothie or shake with a whey powder mix, as it will likely destroy you.

Best of luck figuring out what you can and can't have and finding what lactose free things are available near you.",ig9eaw2,t3_vzj5we,/r/lactoseintolerant/comments/vzj5we/newly_lactose_intolerant_i_guess/ig9eaw2/,1,lactoseintolerant,"['well', 'tell', 'experience', 'uncommon', 'part', 'reason', 'baby', 'need', 'able', 'digest', 'milk', 'nursing', 'supposed', 'need', 'keep', 'drinking', 'milk', 'older', 'body', 'slowly', 'stop', 'wasting', 'energy', 'producing', 'enzyme', 'need', 'many', 'people', 'dairy', 'younger', 'older', 'people', 'lucky', 'mutation', 'body', 'never', 'stop', 'producing', 'lactase', 'passed', 'gene', 'enough', 'common', 'lactose', 'intolerance', 'moment', 'body', 'still', 'producing', 'enzyme', 'enough', 'high', 'lactose', 'product', 'sadly', 'uncommon', 'worse', 'time', 'likely', 'still', 'cheese', 'froyo', 'seem', 'upset', 'cheese', 'yogurt', 'naturally', 'lactose', 'aging', 'brand', 'apparently', 'process', 'lactose', 'cheese', 'part', 'production', 'process', 'generally', 'dairy', 'product', 'culture', 'aged', 'lactose', 'serving', 'many', 'severe', 'people', 'sharp', 'cheese', 'without', 'issue', 'side', 'note', 'since', 'figuring', 'start', 'practicing', 'habit', 'reading', 'label', 'milk', 'whey', 'even', 'straight', 'lactose', 'often', 'added', 'filler', 'random', 'stuff', 'also', 'wary', 'whey', 'apparently', 'lactose', 'something', 'like', 'anyone', 'make', 'protein', 'smoothie', 'shake', 'whey', 'powder', 'likely', 'destroy', 'best', 'luck', 'figuring', 'finding', 'lactose', 'free', 'thing', 'available', 'near']","['well', 'tell', 'experience', 'uncommon', 'part', 'reason', 'baby', 'need', 'able', 'digest', 'milk', 'nursing', 'supposed', 'need', 'keep', 'drinking', 'milk', 'older', 'body', 'slowly', 'stop_wasting', 'energy', 'producing', 'enzyme', 'need', 'many', 'people', 'dairy', 'younger', 'older', 'people', 'lucky', 'mutation', 'body', 'never', 'stop', 'producing', 'lactase', 'passed', 'gene', 'enough', 'common', 'lactose_intolerance', 'moment', 'body', 'still', 'producing', 'enzyme', 'enough', 'high', 'lactose', 'product', 'sadly', 'uncommon', 'worse', 'time', 'likely', 'still', 'cheese', 'froyo', 'seem', 'upset', 'cheese', 'yogurt', 'naturally', 'lactose', 'aging', 'brand', 'apparently', 'process', 'lactose', 'cheese', 'part', 'production', 'process', 'generally', 'dairy_product', 'culture', 'aged', 'lactose', 'serving', 'many', 'severe', 'people', 'sharp', 'cheese', 'without', 'issue', 'side_note', 'since', 'figuring', 'start', 'practicing', 'habit', 'reading', 'label', 'milk', 'whey', 'even', 'straight', 'lactose', 'often', 'added', 'filler', 'random', 'stuff', 'also', 'wary', 'whey', 'apparently', 'lactose', 'something', 'like', 'anyone', 'make', 'protein', 'smoothie', 'shake', 'whey', 'powder', 'likely', 'destroy', 'best_luck', 'figuring', 'finding', 'lactose', 'free', 'thing', 'available', 'near']"
4140,sugoiirex,2022-06-20 18:14:19,I am only saying I’m intolerant because I got my results form a gene test todays that says I’m lactose intolerant also when I throw up and stuff it’s not comparable to food poisoning or something it’s like non stop cramps and it never happened when I drank milk or something I consumed that all my life without ever experiencing symptoms of lactose intolerance,id34kjw,t1_id30vju,/r/lactoseintolerant/comments/vgg5eo/serious_illness_through_lactose_intolerance/id34kjw/,1,lactoseintolerant,"['saying', 'intolerant', 'result', 'form', 'gene', 'test', 'today', 'lactose', 'intolerant', 'also', 'throw', 'stuff', 'comparable', 'food', 'poisoning', 'something', 'like', 'stop', 'cramp', 'never', 'happened', 'drank', 'milk', 'something', 'consumed', 'life', 'without', 'ever', 'experiencing', 'symptom', 'lactose', 'intolerance']","['saying', 'intolerant', 'result', 'form', 'gene', 'test', 'today', 'lactose_intolerant', 'also', 'throw', 'stuff', 'comparable', 'food', 'poisoning', 'something', 'like', 'stop', 'cramp', 'never', 'happened', 'drank', 'milk', 'something', 'consumed', 'life', 'without', 'ever', 'experiencing', 'symptom', 'lactose_intolerance']"
4233,Fred1894,2022-06-16 16:06:10,"The original point of cheese was to break down the lactose in cow's milk in order to make a palatable food for humans. Nowadays many people have a gene to cleave lactose in their guts. People have been making cheese since sometime before history began, but this gene only became widespread in Europe in the second Millennium. We're the normal ones; people who put dairy on everything are mutants. 😁",iclh751,t3_vdofk3,/r/lactoseintolerant/comments/vdofk3/why_do_milk_ice_cream_and_cream_cheese_mess_me_up/iclh751/,1,lactoseintolerant,"['original', 'point', 'cheese', 'break', 'lactose', 'milk', 'order', 'make', 'palatable', 'food', 'human', 'nowadays', 'many', 'people', 'gene', 'cleave', 'lactose', 'people', 'making', 'cheese', 'since', 'sometime', 'history', 'began', 'gene', 'became', 'widespread', 'europe', 'second', 'millennium', 'normal', 'people', 'dairy', 'everything', 'mutant']","['original', 'point', 'cheese', 'break', 'lactose', 'milk', 'order', 'make', 'palatable', 'food', 'human', 'nowadays', 'many', 'people', 'gene', 'cleave', 'lactose', 'people', 'making', 'cheese', 'since', 'sometime', 'history', 'began', 'gene', 'became_widespread', 'europe', 'second', 'millennium', 'normal', 'people', 'dairy', 'everything', 'mutant']"
5465,Shimerald,2022-05-02 17:14:10,"Oh man, I feel you. I've heard lactose intolerance is typically genetic and is actually bad more dominant gene. I got mine from my Dad and he found out in the last few years he's ALSO Celiac. My brother and his daughter got tested and have Celiac as well (but luckily not the LI). I'm pretty sure I've got celiac (but haven't been tested yet) as my husband has it, so I don't eat it at home anymore, and I've noticed I get sick if I have wheat when I eat out.

Hang in there!",i71tfw6,t1_i71rrhi,/r/lactoseintolerant/comments/ugimr6/i_cant_even_eat_out_and_lactase_pills_dont_work/i71tfw6/,1,lactoseintolerant,"['feel', 'heard', 'lactose', 'intolerance', 'typically', 'genetic', 'actually', 'dominant', 'gene', 'mine', 'found', 'last', 'year', 'also', 'celiac', 'brother', 'daughter', 'tested', 'celiac', 'well', 'luckily', 'pretty', 'sure', 'celiac', 'tested', 'husband', 'home', 'anymore', 'noticed', 'sick', 'wheat', 'hang']","['feel', 'heard', 'lactose_intolerance', 'typically', 'genetic', 'actually', 'dominant_gene', 'mine', 'found', 'last_year', 'also', 'celiac', 'brother', 'daughter', 'tested', 'celiac', 'well', 'luckily', 'pretty_sure', 'celiac', 'tested', 'husband', 'home', 'anymore', 'noticed', 'sick', 'wheat', 'hang']"
6383,bebestonline,2022-04-08 19:16:50,"Sorry to hear you have ibs but hope that knowing what the real problem is helps to keep your stomach happy.     
   
   
Btw, it's also possible that you didn't get it through hereditary means and that you were just unlucky with a random gene mutation in early development.",i3xu4pp,t3_txax1n,/r/lactoseintolerant/comments/txax1n/oh_ok_then/i3xu4pp/,1,lactoseintolerant,"['sorry', 'hear', 'hope', 'knowing', 'real', 'problem', 'help', 'keep', 'stomach', 'happy', 'also', 'possible', 'hereditary', 'mean', 'unlucky', 'random', 'gene', 'mutation', 'early', 'development']","['sorry_hear_hope', 'knowing', 'real', 'problem', 'help', 'keep', 'stomach', 'happy', 'also', 'possible', 'hereditary', 'mean', 'unlucky', 'random', 'gene_mutation', 'early', 'development']"
