,author,created_utc,body,id,parent_id,permalink,score,subreddit,body_clean,body_ngrams
43280,madpiratebippy,2019-09-22 05:28:12,"Cow milk has two kinds of protein in it, A1 and A2. The way milk is processed in the US it gets mixed in big tanks so you get both protein types. 

There is a theory that A2 is easier to digest because it’s a way older gene. I can usually handle goat and sheep milk without many issues, so I always figured I was like 10% lactose intolerant and 90% cow milk intolerant and 100% too poor to manage to pay for sheep milk all the time.

It was really nice to be able to enjoy a glass of milk without hurting later, and I think with lactaid I won’t even have the mild issues!",f11sw5r,t1_f09firb,/r/lactoseintolerant/comments/d4a8fe/a2_milk_helps_a_lot/f11sw5r/,1,lactoseintolerant,"['milk', 'kind', 'protein', 'milk', 'processed', 'mixed', 'tank', 'protein', 'type', 'theory', 'easier', 'digest', 'older', 'gene', 'usually', 'handle', 'goat', 'sheep', 'milk', 'without', 'many', 'issue', 'always', 'figured', 'like', 'lactose', 'intolerant', 'milk', 'intolerant', 'poor', 'manage', 'sheep', 'milk', 'time', 'really', 'nice', 'able', 'enjoy', 'glass', 'milk', 'without', 'hurting', 'later', 'think', 'lactaid', 'even', 'mild', 'issue']","['milk', 'kind', 'protein', 'milk', 'processed', 'mixed', 'tank', 'protein', 'type', 'theory', 'easier_digest', 'older', 'gene', 'usually', 'handle', 'goat', 'sheep', 'milk', 'without', 'many', 'issue', 'always', 'figured', 'like', 'lactose_intolerant', 'milk', 'intolerant', 'poor', 'manage', 'sheep', 'milk', 'time', 'really', 'nice', 'able', 'enjoy', 'glass_milk', 'without', 'hurting', 'later', 'think', 'lactaid', 'even', 'mild', 'issue']"
43613,KaneHau,2019-09-06 16:44:53,"Yes.  It happened to me in my early 20's.  Before then I could consume everything with no problems.  Then, a daily chocolate milk started giving me problems... and then all dairy.

23andme can only tell you about trends for people in your grouping. 

We **all** have the genes to deal with diary, but in many of us they deactivate at a certain age.  This is actually normal for the majority of the population.",ez9ro37,t3_d0is6e,/r/lactoseintolerant/comments/d0is6e/is_it_possible_to_suddenly_become_lactose/ez9ro37/,1,lactoseintolerant,"['happened', 'early', 'could', 'consume', 'everything', 'problem', 'daily', 'chocolate', 'milk', 'started', 'giving', 'problem', 'dairy', '23andme', 'tell', 'trend', 'people', 'grouping', 'gene', 'deal', 'diary', 'many', 'deactivate', 'certain', 'actually', 'normal', 'majority', 'population']","['happened', 'early', 'could', 'consume', 'everything', 'problem', 'daily', 'chocolate', 'milk', 'started', 'giving', 'problem', 'dairy', '23andme', 'tell', 'trend', 'people', 'grouping', 'gene', 'deal', 'diary', 'many', 'deactivate', 'certain', 'actually', 'normal', 'majority', 'population']"
43819,KaneHau,2019-08-31 17:50:45,"Antibiotics can change your gut biome - however, that is not a cause for lactose intolerance.

&gt; Lactose intolerance occurs when your small intestine doesn't produce enough of an enzyme (lactase) to digest milk sugar (lactose).

In most people this is due to natural gene deactivation at a certain age.",eyobui8,t3_cxy8m9,/r/lactoseintolerant/comments/cxy8m9/antibiotics_caused_my_li/eyobui8/,2,lactoseintolerant,"['antibiotic', 'change', 'biome', 'however', 'cause', 'lactose', 'intolerance', 'lactose', 'intolerance', 'occurs', 'small', 'intestine', 'produce', 'enough', 'enzyme', 'lactase', 'digest', 'milk', 'sugar', 'lactose', 'people', 'natural', 'gene', 'deactivation', 'certain']","['antibiotic', 'change', 'biome', 'however', 'cause', 'lactose_intolerance', 'lactose_intolerance', 'occurs', 'small', 'intestine', 'produce', 'enough', 'enzyme', 'lactase', 'digest', 'milk', 'sugar', 'lactose', 'people', 'natural', 'gene', 'deactivation', 'certain']"
44495,NeedM0reInput,2019-08-01 07:19:28,"Interesting experience.  I think too often we tend to focus too narrowly on health issues, when broader, more holistic, approaches should be considered.  Alas healthcare professionals are one of the worst offenders IMHO.

This reminds me when I very strictly avoided all potential lactose sources for a good couple of years, whilst also taking good quality probiotics daily.  I then realised that I read able to handle lactose much better, at least for some time after.

IIRC the area of our gut which produces lactase enzyme is at the start of our small intestine, just after our stomach.  In my case atleast, I suspect bad eating habits, shift work and tolerating high stomach acid levels too far too long probably contributed to damaging my lactase enzyme part.

We should also remember that the human ability to breakdown lactose is a very recent development in human evolution and I'm sure I read somewhere, the only evidence of gene mutation in the current global population.",evodasd,t3_ckip83,/r/lactoseintolerant/comments/ckip83/slippery_elm/evodasd/,1,lactoseintolerant,"['interesting', 'experience', 'think', 'often', 'tend', 'focus', 'narrowly', 'health', 'issue', 'broader', 'holistic', 'approach', 'considered', 'healthcare', 'professional', 'worst', 'offender', 'imho', 'reminds', 'strictly', 'avoided', 'potential', 'lactose', 'source', 'good', 'couple', 'year', 'whilst', 'also', 'taking', 'good', 'quality', 'probiotic', 'daily', 'realised', 'read', 'able', 'handle', 'lactose', 'much', 'better', 'least', 'time', 'iirc', 'area', 'produce', 'lactase', 'enzyme', 'start', 'small', 'intestine', 'stomach', 'case', 'atleast', 'suspect', 'eating', 'habit', 'shift', 'work', 'tolerating', 'high', 'stomach', 'acid', 'level', 'long', 'probably', 'contributed', 'damaging', 'lactase', 'enzyme', 'part', 'also', 'remember', 'human', 'ability', 'breakdown', 'lactose', 'recent', 'development', 'human', 'evolution', 'sure', 'read', 'somewhere', 'evidence', 'gene', 'mutation', 'current', 'global', 'population']","['interesting', 'experience', 'think', 'often', 'tend', 'focus', 'narrowly', 'health_issue', 'broader', 'holistic', 'approach', 'considered', 'healthcare_professional', 'worst_offender', 'imho', 'reminds', 'strictly', 'avoided', 'potential', 'lactose', 'source', 'good', 'couple_year', 'whilst', 'also', 'taking', 'good', 'quality', 'probiotic', 'daily', 'realised', 'read', 'able_handle', 'lactose', 'much', 'better', 'least', 'time', 'iirc', 'area', 'produce', 'lactase', 'enzyme', 'start', 'small', 'intestine', 'stomach', 'case', 'atleast', 'suspect', 'eating_habit', 'shift', 'work', 'tolerating', 'high', 'stomach', 'acid', 'level', 'long', 'probably', 'contributed', 'damaging', 'lactase', 'enzyme', 'part', 'also', 'remember', 'human', 'ability', 'breakdown', 'lactose', 'recent', 'development', 'human_evolution', 'sure', 'read_somewhere', 'evidence', 'gene_mutation', 'current', 'global_population']"
44661,Patatarte,2019-07-21 20:43:16,I was told there was a blood test that looked for some kind of gene too ? Many options apparently,euedpn8,t1_eue59ge,/r/lactoseintolerant/comments/cfy4fa/turns_out_i_wasnt_lactose_intolerant/euedpn8/,1,lactoseintolerant,"['told', 'blood', 'test', 'looked', 'kind', 'gene', 'many', 'option', 'apparently']","['told', 'blood', 'test', 'looked', 'kind', 'gene', 'many', 'option', 'apparently']"
45067,MaliceBot,2019-07-01 15:26:41,the lactase enzyme gene sometimes doesn’t get expressed in the same frequency as it did in your youth which can cause intolerance in your adulthood,eshk1nb,t3_c7l5v9,/r/lactoseintolerant/comments/c7l5v9/turned_26_and_suddenly_lactose_intolerant/eshk1nb/,3,lactoseintolerant,"['lactase', 'enzyme', 'gene', 'sometimes', 'expressed', 'frequency', 'youth', 'cause', 'intolerance', 'adulthood']","['lactase', 'enzyme', 'gene', 'sometimes', 'expressed', 'frequency', 'youth', 'cause', 'intolerance', 'adulthood']"
47314,arlomilano,2019-02-21 03:41:35,"So, before lactose tolerance came along thousabds of years ago, everyone was technically intolerant after their breastfeeding months. But, by sheer chance, one person's genes mutated and they were able to digest lactose following breastfeeding. Then, it just continued until a bunch of people were able to digest it. Except us. So, there is a teeny tiny chance you can be born with it, but, based on biology, it's more likely for you to develop it after the breastfeeding (or formula depending on who your mother was) phase rather than at birth.",egxhut8,t3_asxlq6,/r/lactoseintolerant/comments/asxlq6/is_lactose_intolerance_a_thing_you_get_or_born/egxhut8/,1,lactoseintolerant,"['lactose', 'tolerance', 'came', 'along', 'thousabds', 'year', 'everyone', 'technically', 'intolerant', 'breastfeeding', 'month', 'sheer', 'chance', 'person', 'gene', 'mutated', 'able', 'digest', 'lactose', 'following', 'breastfeeding', 'continued', 'bunch', 'people', 'able', 'digest', 'except', 'teeny', 'tiny', 'chance', 'born', 'based', 'biology', 'likely', 'develop', 'breastfeeding', 'formula', 'depending', 'mother', 'phase', 'rather', 'birth']","['lactose_tolerance', 'came', 'along', 'thousabds', 'year', 'everyone', 'technically', 'intolerant', 'breastfeeding', 'month', 'sheer', 'chance', 'person', 'gene', 'mutated', 'able', 'digest', 'lactose', 'following', 'breastfeeding', 'continued', 'bunch', 'people', 'able', 'digest', 'except', 'teeny_tiny', 'chance', 'born', 'based', 'biology', 'likely', 'develop', 'breastfeeding', 'formula', 'depending', 'mother', 'phase', 'rather', 'birth']"
47394,hypnoquery,2019-02-17 01:34:06,"It doesn't really work this way, if your body has entirely stopped producing lactase. If you still produce SOME lactase, it's possible that continuing to eat lactase will signal your body to increase transcription of the lactase gene and make more lactase protein. It may also depend on which genetic variant you have that leads to your lactose intolerance. It's always the same gene that's affected, but there are lots of genetic variations that could cause the reduction in lactase gene expression. Here's some information about lactase gene expression, if you are interested: https://lbc.msu.edu/evo-ed/pages/Lactase/genetics.html",egmuezs,t3_arbg2r,/r/lactoseintolerant/comments/arbg2r/i_read_that_you_can_build_up_tolerance_to_dairy/egmuezs/,1,lactoseintolerant,"['really', 'work', 'body', 'entirely', 'stopped', 'producing', 'lactase', 'still', 'produce', 'lactase', 'possible', 'continuing', 'lactase', 'signal', 'body', 'increase', 'transcription', 'lactase', 'gene', 'make', 'lactase', 'protein', 'also', 'depend', 'genetic', 'variant', 'lead', 'lactose', 'intolerance', 'always', 'gene', 'affected', 'genetic', 'variation', 'could', 'cause', 'reduction', 'lactase', 'gene', 'expression', 'information', 'lactase', 'gene', 'expression', 'interested', 'http', '//lbc.msu.edu/evo-ed/pages/lactase/genetics.html']","['really', 'work', 'body', 'entirely', 'stopped', 'producing', 'lactase', 'still', 'produce', 'lactase', 'possible', 'continuing', 'lactase', 'signal', 'body', 'increase', 'transcription', 'lactase', 'gene', 'make', 'lactase', 'protein', 'also', 'depend', 'genetic', 'variant', 'lead', 'lactose_intolerance', 'always', 'gene', 'affected', 'genetic_variation', 'could', 'cause', 'reduction', 'lactase', 'gene_expression', 'information', 'lactase', 'gene_expression', 'interested', 'http', '//lbc.msu.edu/evo-ed/pages/lactase/genetics.html']"
48733,butterfly1332,2018-11-30 15:57:04,"It IS genetic, but the gene switches off around late teen years/adulthood. ",easkbqp,t1_easjvcv,/r/lactoseintolerant/comments/a1pj5c/so_lactose_intolerance_is_100_genetic/easkbqp/,1,lactoseintolerant,"['genetic', 'gene', 'switch', 'around', 'late', 'teen', 'years/adulthood']","['genetic', 'gene', 'switch', 'around', 'late_teen', 'years/adulthood']"
48736,butterfly1332,2018-11-30 15:28:29,"That's a good point. Just a caveat, no one is lactose intolerant from birth. I think it starts in your late teenage years/adulthood if you have the genes.",easi5xu,t1_eas16kn,/r/lactoseintolerant/comments/a1pj5c/so_lactose_intolerance_is_100_genetic/easi5xu/,3,lactoseintolerant,"['good', 'point', 'caveat', 'lactose', 'intolerant', 'birth', 'think', 'start', 'late', 'teenage', 'years/adulthood', 'gene']","['good', 'point', 'caveat', 'lactose_intolerant', 'birth', 'think', 'start', 'late', 'teenage', 'years/adulthood', 'gene']"
48740,ExtraDan,2018-11-30 05:05:38,"&gt; -really? Where do you live? I live in America and don’t find that I am “always offered food with lactose in it”

I come from Israel, a country of milk and honey, where diary is a bold thing in our society, I just moved to the USA three months ago, and I face situations of being offered lactose products all the time, considering its pennsylvania, its no surprise, people love their cheese! 

&gt;that’s not how it works. You will only cause yourself distress for no reason. Like I said, there certainly are external inducers of genes. But for lactase, the only known one is being an infant. Do you have a time machine? If so please share it.

It appears that it helped some, but its a very rare case and im willing to take it, my lactose intolerance is not severe as others, I dont get stomach pains and extreme gas and diarrhea.

 &gt;— you should not vomit from lactose intolerance. It should only affect excretion out of your butt.

Lactose effects become very intense to me and therefore I throw up, my body has learned to recognize it as an unwanted presence in my body and when theres too much of it, my body chooses to retract it.
Unless I am allergic, but its unlikely as I was not born allergic to diary and I have been training my body by frequently and periodically consuming diary products, my country is also known for the lowest rate of peanut allergy, since we got a famous favorite snack called Bamba that is consumed so very frequently by babies, teens and adults, as silly as it sounds, it works.",earodca,t1_earnjf6,/r/lactoseintolerant/comments/a1c83y/help_the_lct_gene_to_reproduce_lactase_enzymes/earodca/,2,lactoseintolerant,"['-really', 'live', 'live', 'america', 'find', 'always', 'offered', 'food', 'lactose', 'come', 'israel', 'country', 'milk', 'honey', 'diary', 'bold', 'thing', 'society', 'moved', 'three', 'month', 'face', 'situation', 'offered', 'lactose', 'product', 'time', 'considering', 'pennsylvania', 'surprise', 'people', 'love', 'cheese', 'work', 'cause', 'distress', 'reason', 'like', 'said', 'certainly', 'external', 'inducer', 'gene', 'lactase', 'known', 'infant', 'time', 'machine', 'please', 'share', 'appears', 'helped', 'rare', 'case', 'willing', 'take', 'lactose', 'intolerance', 'severe', 'others', 'dont', 'stomach', 'pain', 'extreme', 'diarrhea', 'vomit', 'lactose', 'intolerance', 'affect', 'excretion', 'butt', 'lactose', 'effect', 'become', 'intense', 'therefore', 'throw', 'body', 'learned', 'recognize', 'unwanted', 'presence', 'body', 'there', 'much', 'body', 'chooses', 'retract', 'unless', 'allergic', 'unlikely', 'born', 'allergic', 'diary', 'training', 'body', 'frequently', 'periodically', 'consuming', 'diary', 'product', 'country', 'also', 'known', 'lowest', 'rate', 'peanut', 'allergy', 'since', 'famous', 'favorite', 'snack', 'called', 'bamba', 'consumed', 'frequently', 'baby', 'teen', 'adult', 'silly', 'sound', 'work']","['-really', 'live', 'live', 'america', 'find', 'always', 'offered', 'food', 'lactose', 'come', 'israel', 'country', 'milk', 'honey', 'diary', 'bold', 'thing', 'society', 'moved', 'three_month', 'face', 'situation', 'offered', 'lactose', 'product', 'time', 'considering', 'pennsylvania', 'surprise', 'people', 'love', 'cheese', 'work', 'cause', 'distress', 'reason', 'like', 'said', 'certainly', 'external', 'inducer', 'gene', 'lactase', 'known', 'infant', 'time_machine', 'please', 'share', 'appears', 'helped', 'rare', 'case', 'willing', 'take', 'lactose_intolerance', 'severe', 'others', 'dont', 'stomach', 'pain', 'extreme', 'diarrhea', 'vomit', 'lactose_intolerance', 'affect', 'excretion', 'butt', 'lactose', 'effect', 'become', 'intense', 'therefore', 'throw', 'body', 'learned', 'recognize', 'unwanted', 'presence', 'body', 'there', 'much', 'body', 'chooses', 'retract', 'unless', 'allergic', 'unlikely', 'born', 'allergic', 'diary', 'training', 'body', 'frequently', 'periodically', 'consuming', 'diary', 'product', 'country', 'also', 'known', 'lowest', 'rate', 'peanut', 'allergy', 'since', 'famous', 'favorite', 'snack', 'called', 'bamba', 'consumed', 'frequently', 'baby', 'teen', 'adult', 'silly', 'sound', 'work']"
48742,ExtraDan,2018-11-30 04:44:19,"Thank you for your professional respond, that helps! 
I was hoping there might be some pills or habits to send protocol to your genes to produce more enzymes, but I guess only time will tell until we get something alike! or gene editing, which I would trust less because theres so many fuck ups that could happen on the early stages of gmod editing 

Not eating lactose is easy for me because my body has learned to recognize the symptoms i get from diary products and it doesnt disguise diary products as appetizing food, if anything my brain has evolved to hate and repel diary products while I understand that diary products arent evil, so I can help myself without having diary, but there are challenges I am still facing, we live in a world where almost everything has diary included in it, and I often are socially conflicted by it because I am always offered food that has lactose in it, and it feels kind of rude declining people's offers and having to excuse them by explaining that im lactose intolerant, sometimes its even ruder when i decline the offer of people who personally made whatever diary product they are presenting to me and to a few other 2 people.

But I feel since I wasnt born a lactose intolerant, I think I shall continue practicing eating diary products in hope that maybe my brain will send signals to my smaller intestine to produce more enzymes to combat intolerance.

My body has already started registering any lactose that enters my body as poison since when its really harsh, my body creates mucus to ""flush down"" the lactose like its some kind of an infection, and my body asks me to vomit, just like how people throw up alcohol or any products your body think are a poison for you, so I think I should just keep pumping lactose into my body until my brain understands that im breathing it in like oxygen, and that instead of combating it, it should break it down.",earn0yu,t1_eaq0ghw,/r/lactoseintolerant/comments/a1c83y/help_the_lct_gene_to_reproduce_lactase_enzymes/earn0yu/,1,lactoseintolerant,"['thank', 'professional', 'respond', 'help', 'hoping', 'might', 'pill', 'habit', 'send', 'protocol', 'gene', 'produce', 'enzyme', 'guess', 'time', 'tell', 'something', 'alike', 'gene', 'editing', 'would', 'trust', 'there', 'many', 'fuck', 'could', 'happen', 'early', 'stage', 'gmod', 'editing', 'eating', 'lactose', 'easy', 'body', 'learned', 'recognize', 'symptom', 'diary', 'product', 'doesnt', 'disguise', 'diary', 'product', 'appetizing', 'food', 'anything', 'brain', 'evolved', 'hate', 'repel', 'diary', 'product', 'understand', 'diary', 'product', 'arent', 'evil', 'help', 'without', 'diary', 'challenge', 'still', 'facing', 'live', 'world', 'almost', 'everything', 'diary', 'included', 'often', 'socially', 'conflicted', 'always', 'offered', 'food', 'lactose', 'feel', 'kind', 'rude', 'declining', 'people', 'offer', 'excuse', 'explaining', 'lactose', 'intolerant', 'sometimes', 'even', 'ruder', 'decline', 'offer', 'people', 'personally', 'made', 'whatever', 'diary', 'product', 'presenting', 'people', 'feel', 'since', 'wasnt', 'born', 'lactose', 'intolerant', 'think', 'shall', 'continue', 'practicing', 'eating', 'diary', 'product', 'hope', 'maybe', 'brain', 'send', 'signal', 'smaller', 'intestine', 'produce', 'enzyme', 'combat', 'intolerance', 'body', 'already', 'started', 'registering', 'lactose', 'enters', 'body', 'poison', 'since', 'really', 'harsh', 'body', 'creates', 'mucus', 'flush', 'lactose', 'like', 'kind', 'infection', 'body', 'asks', 'vomit', 'like', 'people', 'throw', 'alcohol', 'product', 'body', 'think', 'poison', 'think', 'keep', 'pumping', 'lactose', 'body', 'brain', 'understands', 'breathing', 'like', 'oxygen', 'instead', 'combating', 'break']","['thank', 'professional', 'respond', 'help', 'hoping', 'might', 'pill', 'habit', 'send', 'protocol', 'gene', 'produce', 'enzyme', 'guess', 'time', 'tell', 'something', 'alike', 'gene', 'editing', 'would', 'trust', 'there', 'many', 'fuck', 'could', 'happen', 'early_stage', 'gmod', 'editing', 'eating', 'lactose', 'easy', 'body', 'learned', 'recognize', 'symptom', 'diary', 'product', 'doesnt', 'disguise', 'diary', 'product', 'appetizing', 'food', 'anything', 'brain', 'evolved', 'hate', 'repel', 'diary', 'product', 'understand', 'diary', 'product', 'arent', 'evil', 'help', 'without', 'diary', 'challenge', 'still', 'facing', 'live', 'world', 'almost', 'everything', 'diary', 'included', 'often', 'socially', 'conflicted', 'always', 'offered', 'food', 'lactose', 'feel', 'kind', 'rude', 'declining', 'people', 'offer', 'excuse', 'explaining', 'lactose_intolerant', 'sometimes', 'even', 'ruder', 'decline', 'offer', 'people', 'personally', 'made', 'whatever', 'diary', 'product', 'presenting', 'people', 'feel', 'since', 'wasnt', 'born', 'lactose_intolerant', 'think', 'shall', 'continue', 'practicing', 'eating', 'diary', 'product', 'hope', 'maybe', 'brain', 'send', 'signal', 'smaller', 'intestine', 'produce', 'enzyme', 'combat', 'intolerance', 'body', 'already', 'started', 'registering', 'lactose', 'enters', 'body', 'poison', 'since', 'really', 'harsh', 'body', 'creates', 'mucus', 'flush', 'lactose', 'like', 'kind', 'infection', 'body', 'asks', 'vomit', 'like', 'people', 'throw', 'alcohol', 'product', 'body', 'think', 'poison', 'think', 'keep', 'pumping', 'lactose', 'body', 'brain', 'understands', 'breathing', 'like', 'oxygen', 'instead', 'combating', 'break']"
48750,ExtraDan,2018-11-29 04:31:36,"I was thinking of that method! 
But considering its a gene thing related thing, I suspect that eating a lot of lactose will not work on your behalf, but will genetically help your newborn be more tolerant to lactose consumption.
I feel like since its genetic, you might not be able to reprogram your LCT gene by overwhelming your stomach with lactose because your gene is programmed to lower it's efficiency through time.
Unless its a miracle by of course and theres some lucky people out there that their guts recognize a the problem and offer a solution without the need of adapting it to the next generation.
But I believe that there might be a way to trigger the LCT gene cells, to give them an instruction to reproduce lactate again! but thats sounds like something very difficult to achieve, but just because something sounds impossible, doesnt mean people didnt find a way to do that!

Thank you for your info!",eap0iwm,t1_eaoq2bn,/r/lactoseintolerant/comments/a1c83y/help_the_lct_gene_to_reproduce_lactase_enzymes/eap0iwm/,1,lactoseintolerant,"['thinking', 'method', 'considering', 'gene', 'thing', 'related', 'thing', 'suspect', 'eating', 'lactose', 'work', 'behalf', 'genetically', 'help', 'newborn', 'tolerant', 'lactose', 'consumption', 'feel', 'like', 'since', 'genetic', 'might', 'able', 'reprogram', 'gene', 'overwhelming', 'stomach', 'lactose', 'gene', 'programmed', 'lower', 'efficiency', 'time', 'unless', 'miracle', 'course', 'there', 'lucky', 'people', 'recognize', 'problem', 'offer', 'solution', 'without', 'need', 'adapting', 'next', 'generation', 'believe', 'might', 'trigger', 'gene', 'cell', 'give', 'instruction', 'reproduce', 'lactate', 'thats', 'sound', 'like', 'something', 'difficult', 'achieve', 'something', 'sound', 'impossible', 'doesnt', 'mean', 'people', 'didnt', 'find', 'thank', 'info']","['thinking', 'method', 'considering', 'gene', 'thing', 'related', 'thing', 'suspect', 'eating', 'lactose', 'work', 'behalf', 'genetically', 'help', 'newborn', 'tolerant', 'lactose', 'consumption', 'feel_like', 'since', 'genetic', 'might', 'able', 'reprogram', 'gene', 'overwhelming', 'stomach', 'lactose', 'gene', 'programmed', 'lower', 'efficiency', 'time', 'unless', 'miracle', 'course', 'there', 'lucky', 'people', 'recognize', 'problem', 'offer', 'solution', 'without', 'need', 'adapting', 'next', 'generation', 'believe', 'might', 'trigger', 'gene', 'cell', 'give', 'instruction', 'reproduce', 'lactate', 'thats', 'sound_like', 'something', 'difficult', 'achieve', 'something', 'sound', 'impossible', 'doesnt_mean', 'people', 'didnt', 'find', 'thank', 'info']"
