,author,created_utc,body,id,parent_id,permalink,score,subreddit,body_clean,body_ngrams
6265,8percentjuice,2022-04-11 13:35:48,"I agree,however I would say that we can help people who may be on the fence about whether their symptoms are serious enough to go to a doc. 

Many many years ago, I was very sick for a while and not in my right head, and I went to the Americans with Diabetes website to take a quiz that said “are you at risk for diabetes?”thinking it would tell me if what I had may be diabetes. But it just took me through the environmental and racial factors that make it more likely that someone will get type 2 diabetes, when I had undiagnosed type 1 diabetes. That quiz convinced me not to go to the doc for another two weeks. Had it been another diabetic on a support subreddit like this one, they would have forced me to go to the doc as I had classic symptoms. 

I like to belong to subreddits like this so I can convince those folks who are on the fence about going to the doc that there’s nothing scarier than not having a diagnosis, so go get checked out already.",i4aj382,t3_u171kp,/r/lactoseintolerant/comments/u171kp/reddit_isnt_the_place_to_get_diagnosed_for/i4aj382/,1,lactoseintolerant,"['agree', 'however', 'would', 'help', 'people', 'fence', 'whether', 'symptom', 'serious', 'enough', 'many', 'many', 'year', 'sick', 'right', 'head', 'went', 'american', 'diabetes', 'website', 'take', 'quiz', 'said', 'risk', 'diabetes', 'thinking', 'would', 'tell', 'diabetes', 'took', 'environmental', 'racial', 'factor', 'make', 'likely', 'someone', 'type', 'diabetes', 'undiagnosed', 'type', 'diabetes', 'quiz', 'convinced', 'another', 'week', 'another', 'diabetic', 'support', 'subreddit', 'like', 'would', 'forced', 'classic', 'symptom', 'like', 'belong', 'subreddits', 'like', 'convince', 'folk', 'fence', 'going', 'nothing', 'scarier', 'diagnosis', 'checked', 'already']","['agree', 'however', 'would', 'help', 'people', 'fence', 'whether', 'symptom', 'serious', 'enough', 'many', 'many', 'year', 'sick', 'right', 'head', 'went', 'american', 'diabetes', 'website', 'take', 'quiz', 'said', 'risk_diabetes', 'thinking', 'would', 'tell', 'diabetes', 'took', 'environmental', 'racial', 'factor', 'make', 'likely', 'someone', 'type_diabetes', 'undiagnosed', 'type_diabetes', 'quiz', 'convinced', 'another', 'week', 'another', 'diabetic', 'support', 'subreddit', 'like', 'would', 'forced', 'classic', 'symptom', 'like', 'belong', 'subreddits', 'like', 'convince', 'folk', 'fence', 'going', 'nothing', 'scarier', 'diagnosis', 'checked', 'already']"
17602,8percentjuice,2022-04-11 13:35:48,"I agree,however I would say that we can help people who may be on the fence about whether their symptoms are serious enough to go to a doc. 

Many many years ago, I was very sick for a while and not in my right head, and I went to the Americans with Diabetes website to take a quiz that said “are you at risk for diabetes?”thinking it would tell me if what I had may be diabetes. But it just took me through the environmental and racial factors that make it more likely that someone will get type 2 diabetes, when I had undiagnosed type 1 diabetes. That quiz convinced me not to go to the doc for another two weeks. Had it been another diabetic on a support subreddit like this one, they would have forced me to go to the doc as I had classic symptoms. 

I like to belong to subreddits like this so I can convince those folks who are on the fence about going to the doc that there’s nothing scarier than not having a diagnosis, so go get checked out already.",i4aj382,t3_u171kp,/r/lactoseintolerant/comments/u171kp/reddit_isnt_the_place_to_get_diagnosed_for/i4aj382/,1,lactoseintolerant,"['agree', 'however', 'would', 'help', 'people', 'fence', 'whether', 'symptom', 'serious', 'enough', 'many', 'many', 'year', 'sick', 'right', 'head', 'went', 'american', 'diabetes', 'website', 'take', 'quiz', 'said', 'risk', 'diabetes', 'thinking', 'would', 'tell', 'diabetes', 'took', 'environmental', 'racial', 'factor', 'make', 'likely', 'someone', 'type', 'diabetes', 'undiagnosed', 'type', 'diabetes', 'quiz', 'convinced', 'another', 'week', 'another', 'diabetic', 'support', 'subreddit', 'like', 'would', 'forced', 'classic', 'symptom', 'like', 'belong', 'subreddits', 'like', 'convince', 'folk', 'fence', 'going', 'nothing', 'scarier', 'diagnosis', 'checked', 'already']","['agree', 'however', 'would', 'help', 'people', 'fence', 'whether', 'symptom', 'serious', 'enough', 'many', 'many', 'year', 'sick', 'right', 'head', 'went', 'american', 'diabetes', 'website', 'take', 'quiz', 'said', 'risk_diabetes', 'thinking', 'would', 'tell', 'diabetes', 'took', 'environmental', 'racial', 'factor', 'make', 'likely', 'someone', 'type_diabetes', 'undiagnosed', 'type_diabetes', 'quiz', 'convinced', 'another', 'week', 'another', 'diabetic', 'support', 'subreddit', 'like', 'would', 'forced', 'classic', 'symptom', 'like', 'belong', 'subreddits', 'like', 'convince', 'folk', 'fence', 'going', 'nothing', 'scarier', 'diagnosis', 'checked', 'already']"
31619,vonnegutflora,2020-12-18 21:06:11,"There is a genetic component to lactose tolerance that tends to correlate with your racial background. People of European ancestry are by far the least likely people to develop lactose intolerance because cow's milk and products made from it have been a staple of their cuisine for thousands of years. 

On the other hand, people of Asian descent are more likely to be lactose intolerant because it wasn't genetically important to select for increased or longer lactase production. Because historically, milk and milk products were not a significant food source for those populations.

Meanwhile, I'm here with 100% Scandinavian ancestors who have a 1% chance of being lactose intolerant... and I've got it.",ggalsxh,t3_kfj58o,/r/lactoseintolerant/comments/kfj58o/dna_says_im_lactose_intolerant/ggalsxh/,3,lactoseintolerant,"['genetic', 'component', 'lactose', 'tolerance', 'tends', 'correlate', 'racial', 'background', 'people', 'european', 'ancestry', 'least', 'likely', 'people', 'develop', 'lactose', 'intolerance', 'milk', 'product', 'made', 'staple', 'cuisine', 'thousand', 'year', 'hand', 'people', 'asian', 'descent', 'likely', 'lactose', 'intolerant', 'genetically', 'important', 'select', 'increased', 'longer', 'lactase', 'production', 'historically', 'milk', 'milk', 'product', 'significant', 'food', 'source', 'population', 'meanwhile', 'scandinavian', 'ancestor', 'chance', 'lactose', 'intolerant']","['genetic_component', 'lactose_tolerance', 'tends', 'correlate', 'racial_background', 'people', 'european', 'ancestry', 'least', 'likely', 'people', 'develop', 'lactose_intolerance', 'milk', 'product', 'made', 'staple', 'cuisine', 'thousand_year', 'hand', 'people', 'asian', 'descent', 'likely', 'lactose_intolerant', 'genetically', 'important', 'select', 'increased', 'longer', 'lactase', 'production', 'historically', 'milk', 'milk', 'product', 'significant', 'food', 'source', 'population', 'meanwhile', 'scandinavian', 'ancestor', 'chance', 'lactose_intolerant']"
36621,sarisaberry,2020-07-09 19:11:08,"This is the first thing google shows:

[Gender, Age, Race and Lactose Intolerance: Is There Evidence to Support a Differential Symptom Response? A Scoping Review](https://www.ncbi.nlm.nih.gov/pmc/articles/PMC6316196/)

It seems to be a meta-analysis. The abstract concludes:

&gt;The evidence suggests that women, the elderly or specific racial groups are not more susceptible to LI, but rather dose, body size and genetic differences in lactase non-persistence (LNP) are the primary drivers of intolerance symptoms.

I think until extensive research is done across different age groups, ethnicities, geographic location, genders, and histories of lactose consumption, all we can provide you with is anecdotal data... Unless your search for research and statistics is more fruitful than mine. :)

Your question would actually be a good hypothesis for research. X'D",fxgaxt6,t3_ho73v8,/r/lactoseintolerant/comments/ho73v8/is_lactose_intolerance_more_common_in_women/fxgaxt6/,2,lactoseintolerant,"['first', 'thing', 'google', 'show', 'gender', 'race', 'lactose', 'intolerance', 'evidence', 'support', 'differential', 'symptom', 'response', 'scoping', 'review', 'http', '//www.ncbi.nlm.nih.gov/pmc/articles/pmc6316196/', 'seems', 'meta-analysis', 'abstract', 'concludes', 'evidence', 'suggests', 'woman', 'elderly', 'specific', 'racial', 'group', 'susceptible', 'rather', 'dose', 'body', 'size', 'genetic', 'difference', 'lactase', 'non-persistence', 'primary', 'driver', 'intolerance', 'symptom', 'think', 'extensive', 'research', 'done', 'across', 'different', 'group', 'ethnicity', 'geographic', 'location', 'gender', 'history', 'lactose', 'consumption', 'provide', 'anecdotal', 'data', 'unless', 'search', 'research', 'statistic', 'fruitful', 'mine', 'question', 'would', 'actually', 'good', 'hypothesis', 'research']","['first', 'thing', 'google', 'show', 'gender', 'race', 'lactose_intolerance', 'evidence_support', 'differential', 'symptom', 'response', 'scoping', 'review', 'http', '//www.ncbi.nlm.nih.gov/pmc/articles/pmc6316196/', 'seems', 'meta-analysis', 'abstract', 'concludes', 'evidence_suggests', 'woman', 'elderly', 'specific', 'racial_group', 'susceptible', 'rather', 'dose', 'body', 'size', 'genetic_difference', 'lactase', 'non-persistence', 'primary', 'driver', 'intolerance', 'symptom', 'think', 'extensive_research', 'done', 'across', 'different', 'group', 'ethnicity', 'geographic_location', 'gender', 'history', 'lactose', 'consumption', 'provide', 'anecdotal', 'data', 'unless', 'search', 'research', 'statistic', 'fruitful', 'mine', 'question', 'would', 'actually', 'good', 'hypothesis', 'research']"
