,author,created_utc,body,id,parent_id,permalink,score,subreddit,body_clean,body_ngrams
28553,shitbutterlover,2021-04-30 03:00:34,there are two types of lactose intolerance one type is heritable and the other type is not heritable. The first type is caused by a recession of the LCT gene the LCT gene prevalence is a mutation. the second type of lactose intolerance is caused by other issues which caused an im balance of bacteria in the gut or give your body a type of strain which causes it to produce less lactase. The second type is “curable” if the other issue is treated.,gwdq9ei,t3_n1iwu9,/r/lactoseintolerant/comments/n1iwu9/will_drinking_milk_damage_my_stomach_permanently/gwdq9ei/,1,lactoseintolerant,"['type', 'lactose', 'intolerance', 'type', 'heritable', 'type', 'heritable', 'first', 'type', 'caused', 'recession', 'gene', 'gene', 'prevalence', 'mutation', 'second', 'type', 'lactose', 'intolerance', 'caused', 'issue', 'caused', 'balance', 'bacteria', 'give', 'body', 'type', 'strain', 'cause', 'produce', 'lactase', 'second', 'type', 'curable', 'issue', 'treated']","['type', 'lactose_intolerance', 'type', 'heritable', 'type', 'heritable', 'first', 'type', 'caused', 'recession', 'gene', 'gene', 'prevalence', 'mutation', 'second', 'type', 'lactose_intolerance', 'caused', 'issue', 'caused', 'balance', 'bacteria', 'give', 'body_type', 'strain', 'cause', 'produce', 'lactase', 'second', 'type', 'curable', 'issue', 'treated']"
31145,acidicpills,2021-01-06 23:57:54,"Majority of the lactase brands in my country all have it listed on their boxes as potential side effects of over use or general use. All of which are the lactose intolerance symptoms. Essentially too much lactase can cause more problems, it’s like taking too much Iron. If you have a correct iron level, there’s no reason to take supplements. In case of intolerance, the body can simply reject the enzyme, all boils down to your LCT gene ( Gene responsible for lactase production)",gid4fv1,t1_gid3ryi,/r/lactoseintolerant/comments/krximz/need_410_kirkland_signature_lactase_pills_per_meal/gid4fv1/,3,lactoseintolerant,"['majority', 'lactase', 'brand', 'country', 'listed', 'potential', 'side', 'effect', 'general', 'lactose', 'intolerance', 'symptom', 'essentially', 'much', 'lactase', 'cause', 'problem', 'like', 'taking', 'much', 'iron', 'correct', 'iron', 'level', 'reason', 'take', 'supplement', 'case', 'intolerance', 'body', 'simply', 'reject', 'enzyme', 'boil', 'gene', 'gene', 'responsible', 'lactase', 'production']","['majority', 'lactase', 'brand', 'country', 'listed', 'potential', 'side', 'effect', 'general', 'lactose_intolerance', 'symptom', 'essentially', 'much', 'lactase', 'cause', 'problem', 'like', 'taking', 'much', 'iron', 'correct', 'iron_level', 'reason', 'take', 'supplement', 'case', 'intolerance', 'body', 'simply', 'reject', 'enzyme', 'boil', 'gene', 'gene_responsible', 'lactase', 'production']"
33529,caffeine_city,2020-10-09 15:25:32,"I feel like the one gene does not tell the entire story. That's why you can go to starbucks and see black, asian, hispanic, middle eastern, south european, russian people. Basically, tons of the people from the purple, orange, light green, and yellow countries drink lattes and eat pizzas and ice cream, and often their worst symptom is gas/bloating. If you go to japan and look at the instant coffees, a ton of them have milk. These are in tons of vending machines everywhere. You can be in the middle of nowhere and find one of these machines.

In my opinion, something else is going on for extreme lactose intolerance. something that is more like celiacs, that probably affects a modern western diet more than other diets.",g882z9y,t1_g7oluyi,/r/lactoseintolerant/comments/j4zbsd/lactose_intolerant_people_around_the_world/g882z9y/,1,lactoseintolerant,"['feel', 'like', 'gene', 'tell', 'entire', 'story', 'starbucks', 'black', 'asian', 'hispanic', 'middle', 'eastern', 'south', 'european', 'russian', 'people', 'basically', 'people', 'purple', 'orange', 'light', 'green', 'yellow', 'country', 'drink', 'latte', 'pizza', 'cream', 'often', 'worst', 'symptom', 'gas/bloating', 'japan', 'look', 'instant', 'coffee', 'milk', 'vending', 'machine', 'everywhere', 'middle', 'nowhere', 'find', 'machine', 'opinion', 'something', 'else', 'going', 'extreme', 'lactose', 'intolerance', 'something', 'like', 'celiacs', 'probably', 'affect', 'modern', 'western', 'diet', 'diet']","['feel_like', 'gene', 'tell', 'entire', 'story', 'starbucks', 'black', 'asian', 'hispanic', 'middle_eastern', 'south', 'european', 'russian', 'people', 'basically', 'people', 'purple_orange', 'light_green', 'yellow', 'country', 'drink', 'latte', 'pizza', 'cream', 'often', 'worst', 'symptom', 'gas/bloating', 'japan', 'look', 'instant', 'coffee', 'milk', 'vending', 'machine', 'everywhere', 'middle_nowhere', 'find', 'machine', 'opinion', 'something_else', 'going', 'extreme', 'lactose_intolerance', 'something', 'like', 'celiacs', 'probably', 'affect', 'modern', 'western', 'diet', 'diet']"
33530,caffeine_city,2020-10-09 15:09:19,"it was obviously helpful in the region, or it would not have spread. but even sickle cell provides benefits in a large population in some regions.

there could be a connection between lactose tolerance and some other autoimmune disease. There are benefits, but there can also be negative side effects.

think about this. why would an animal evolve for lactase production to stop? because the populations that had that stopping gene may have had a better ability to survive. not just humans, but every other animal.",g881350,t1_g7oz2hy,/r/lactoseintolerant/comments/j4zbsd/lactose_intolerant_people_around_the_world/g881350/,1,lactoseintolerant,"['obviously', 'helpful', 'region', 'would', 'spread', 'even', 'sickle', 'cell', 'provides', 'benefit', 'large', 'population', 'region', 'could', 'connection', 'lactose', 'tolerance', 'autoimmune', 'disease', 'benefit', 'also', 'negative', 'side', 'effect', 'think', 'would', 'animal', 'evolve', 'lactase', 'production', 'stop', 'population', 'stopping', 'gene', 'better', 'ability', 'survive', 'human', 'every', 'animal']","['obviously', 'helpful', 'region', 'would', 'spread', 'even', 'sickle_cell', 'provides', 'benefit', 'large', 'population', 'region', 'could', 'connection', 'lactose_tolerance', 'autoimmune_disease', 'benefit', 'also', 'negative', 'side', 'effect', 'think', 'would', 'animal', 'evolve', 'lactase', 'production', 'stop', 'population', 'stopping', 'gene', 'better', 'ability', 'survive', 'human', 'every', 'animal']"
33699,TheJivvi,2020-10-04 20:30:22,"Same. The rest of my genes are from around the same area, so probably all of them actually.",g7pxb6e,t1_g7phf59,/r/lactoseintolerant/comments/j4zbsd/lactose_intolerant_people_around_the_world/g7pxb6e/,1,lactoseintolerant,"['rest', 'gene', 'around', 'area', 'probably', 'actually']","['rest', 'gene', 'around', 'area', 'probably', 'actually']"
33706,TheJivvi,2020-10-04 16:30:34,"It's not a disease. Lactose intolerance after infancy is normal. A lot of people don't stop eating dairy, and they still become lactose intolerant, because the gene was working correctly, and stopped lactase production when it was supposed to. Lactase persistence is a genetic mutation, albeit a beneficial one.",g7oz2hy,t1_g7ovp4a,/r/lactoseintolerant/comments/j4zbsd/lactose_intolerant_people_around_the_world/g7oz2hy/,1,lactoseintolerant,"['disease', 'lactose', 'intolerance', 'infancy', 'normal', 'people', 'stop', 'eating', 'dairy', 'still', 'become', 'lactose', 'intolerant', 'gene', 'working', 'correctly', 'stopped', 'lactase', 'production', 'supposed', 'lactase', 'persistence', 'genetic', 'mutation', 'albeit', 'beneficial']","['disease', 'lactose_intolerance', 'infancy', 'normal', 'people', 'stop', 'eating', 'dairy', 'still', 'become', 'lactose_intolerant', 'gene', 'working', 'correctly', 'stopped', 'lactase', 'production', 'supposed', 'lactase_persistence', 'genetic_mutation', 'albeit', 'beneficial']"
33712,TheJivvi,2020-10-04 14:54:11,"Not even being able to breastfeed is actually really really unusual. Almost everyone produces lactase until about age 2 or 3, which is why the opposite of lactose intolerance is called lactase persistence. We have a gene that's supposed to turn off lactase production, but sometimes there's a genetic mutation that causes it to fail, so lactase production persists into adulthood. Not producing any lactase in the first place is insanely rare.

My mum put me on soy milk when I was a kid, and when I tried cow's milk again I didn't like it, so I just kept using soy. A lot of yoghurt and cheese is lactose free too, so if I had some that wasn't, I never really made the connection, because it didn't happen every time.",g7oobwr,t1_g7on31z,/r/lactoseintolerant/comments/j4zbsd/lactose_intolerant_people_around_the_world/g7oobwr/,1,lactoseintolerant,"['even', 'able', 'breastfeed', 'actually', 'really', 'really', 'unusual', 'almost', 'everyone', 'produce', 'lactase', 'opposite', 'lactose', 'intolerance', 'called', 'lactase', 'persistence', 'gene', 'supposed', 'turn', 'lactase', 'production', 'sometimes', 'genetic', 'mutation', 'cause', 'fail', 'lactase', 'production', 'persists', 'adulthood', 'producing', 'lactase', 'first', 'place', 'insanely', 'rare', 'milk', 'tried', 'milk', 'like', 'kept', 'using', 'yoghurt', 'cheese', 'lactose', 'free', 'never', 'really', 'made', 'connection', 'happen', 'every', 'time']","['even', 'able', 'breastfeed', 'actually', 'really', 'really', 'unusual', 'almost', 'everyone', 'produce', 'lactase', 'opposite', 'lactose_intolerance', 'called', 'lactase_persistence', 'gene', 'supposed', 'turn', 'lactase', 'production', 'sometimes', 'genetic_mutation', 'cause', 'fail', 'lactase', 'production', 'persists', 'adulthood', 'producing', 'lactase', 'first', 'place', 'insanely', 'rare', 'milk', 'tried', 'milk', 'like', 'kept', 'using', 'yoghurt', 'cheese', 'lactose', 'free', 'never', 'really', 'made', 'connection', 'happen', 'every', 'time']"
33813,Utanorang,2020-10-01 11:39:49,"I dont know if this is what you are referring to but a couple years back, a dude with LI did some fun gene stuff at home in a petri dish, moved his science project to a capsule, and swallowed it. He was clinically cured for his experiments but the whole like gene modifying community condemned the project because the strain of whatever he used is super invasive and at risk for affecting more than just his gut cells.",g79y4tj,t3_j32upk,/r/lactoseintolerant/comments/j32upk/would_you_buy_a_pill_that_makes_you_lactose/g79y4tj/,1,lactoseintolerant,"['dont', 'know', 'referring', 'couple', 'year', 'back', 'dude', 'gene', 'stuff', 'home', 'petri', 'dish', 'moved', 'science', 'project', 'capsule', 'swallowed', 'clinically', 'cured', 'experiment', 'whole', 'like', 'gene', 'modifying', 'community', 'condemned', 'project', 'strain', 'whatever', 'used', 'super', 'invasive', 'risk', 'affecting', 'cell']","['dont', 'know', 'referring', 'couple_year', 'back', 'dude', 'gene', 'stuff', 'home', 'petri', 'dish', 'moved', 'science', 'project', 'capsule', 'swallowed', 'clinically', 'cured', 'experiment', 'whole', 'like', 'gene', 'modifying', 'community', 'condemned', 'project', 'strain', 'whatever', 'used', 'super', 'invasive', 'risk', 'affecting', 'cell']"
35043,osomfinch,2020-08-31 00:07:49,"Do the genetic test. If you don't have the genes, then no, you'll never be able to produce lactase(the ferment that breaks down lactose). If you have the genes, then your lactose intolerance is temporary.",g3eymky,t3_igjotk,/r/lactoseintolerant/comments/igjotk/does_lactose_intolerance_ever_go_away/g3eymky/,1,lactoseintolerant,"['genetic', 'test', 'gene', 'never', 'able', 'produce', 'lactase', 'ferment', 'break', 'lactose', 'gene', 'lactose', 'intolerance', 'temporary']","['genetic', 'test', 'gene', 'never', 'able', 'produce', 'lactase', 'ferment', 'break', 'lactose', 'gene', 'lactose_intolerance', 'temporary']"
36622,AITAPepperFlakes,2020-07-09 18:51:23,"No, Lactose tolerance is caused by a slew of genes that’s not in a sex chromosome. Though, women might suffer from worse reactions if they are intolerant.",fxg8fa9,t3_ho73v8,/r/lactoseintolerant/comments/ho73v8/is_lactose_intolerance_more_common_in_women/fxg8fa9/,1,lactoseintolerant,"['lactose', 'tolerance', 'caused', 'slew', 'gene', 'chromosome', 'though', 'woman', 'might', 'suffer', 'worse', 'reaction', 'intolerant']","['lactose_tolerance', 'caused', 'slew', 'gene', 'chromosome', 'though', 'woman', 'might', 'suffer', 'worse', 'reaction', 'intolerant']"
37327,Jacksvenson96,2020-06-18 17:10:15,Its nothing fancy. Just go to your local market and get a good dose of probiotics daily. Gene therapy is also a reality but im not waiting that long for it to be commercialized in order to enjoy my treat.,fv90kxo,t1_fv904x3,/r/lactoseintolerant/comments/hbbn7p/the_time_has_come_for_me_to_forget_that_i_ever/fv90kxo/,0,lactoseintolerant,"['nothing', 'fancy', 'local', 'market', 'good', 'dose', 'probiotic', 'daily', 'gene', 'therapy', 'also', 'reality', 'waiting', 'long', 'commercialized', 'order', 'enjoy', 'treat']","['nothing', 'fancy', 'local', 'market', 'good', 'dose', 'probiotic', 'daily', 'gene', 'therapy', 'also', 'reality', 'waiting', 'long', 'commercialized', 'order', 'enjoy', 'treat']"
38113,DisastrousOcelot1,2020-05-12 20:26:35,"Yeah I think your right it seems genetically if you can’t digest it you need to steer clear of it altogether. I guess only 77% of folks with the gene are lactose intolerant but apparently I got sick as a baby from dairy and I’ve been having issues. Just got my full report this from promeatheaus and it’s very interesting. Some good things , but also am a carrier for a nasty gene that promotes a disease my half sister has. This gene stuff is crazy!
Enjoy your day!",fqexg3i,t1_fqeld8n,/r/lactoseintolerant/comments/gib3ph/anyone_else_find_out_via_gene_testing/fqexg3i/,1,lactoseintolerant,"['yeah', 'think', 'right', 'seems', 'genetically', 'digest', 'need', 'steer', 'clear', 'altogether', 'guess', 'folk', 'gene', 'lactose', 'intolerant', 'apparently', 'sick', 'baby', 'dairy', 'issue', 'full', 'report', 'promeatheaus', 'interesting', 'good', 'thing', 'also', 'carrier', 'nasty', 'gene', 'promotes', 'disease', 'half', 'sister', 'gene', 'stuff', 'crazy', 'enjoy']","['yeah', 'think', 'right', 'seems', 'genetically', 'digest', 'need', 'steer_clear', 'altogether', 'guess', 'folk', 'gene', 'lactose_intolerant', 'apparently', 'sick', 'baby', 'dairy', 'issue', 'full', 'report', 'promeatheaus', 'interesting', 'good', 'thing', 'also', 'carrier', 'nasty', 'gene', 'promotes', 'disease', 'half_sister', 'gene', 'stuff', 'crazy', 'enjoy']"
38114,francerex,2020-05-12 18:51:16,"Yes, my test also said that I am likely sensible to gluten, which confirms the symptoms i have if i eat too much of it (but it could be simply fodmap). My the celiac test was negative

ps in your case, like mine, since you have primary intolerance (no gene), the lactase supplement are probably not going to help much",fqeld8n,t3_gib3ph,/r/lactoseintolerant/comments/gib3ph/anyone_else_find_out_via_gene_testing/fqeld8n/,1,lactoseintolerant,"['test', 'also', 'said', 'likely', 'sensible', 'gluten', 'confirms', 'symptom', 'much', 'could', 'simply', 'fodmap', 'celiac', 'test', 'negative', 'case', 'like', 'mine', 'since', 'primary', 'intolerance', 'gene', 'lactase', 'supplement', 'probably', 'going', 'help', 'much']","['test', 'also', 'said', 'likely', 'sensible', 'gluten', 'confirms', 'symptom', 'much', 'could', 'simply', 'fodmap', 'celiac', 'test', 'negative', 'case', 'like', 'mine', 'since', 'primary', 'intolerance', 'gene', 'lactase', 'supplement', 'probably', 'going', 'help', 'much']"
38132,Artistic_Call,2020-05-11 15:52:03,"I have celiac disease too, as well as NAFLD. Increased risk of autoimmune liver disease and RA. I also have hypothyroidism. I don't think it's lactose intolerance itself, I think it's your genes.

Scary stuff. :(",fqa3tep,t3_ghkjvi,/r/lactoseintolerant/comments/ghkjvi/a_question_about_lactose_intolerance_and_cancer/fqa3tep/,1,lactoseintolerant,"['celiac', 'disease', 'well', 'nafld', 'increased', 'risk', 'autoimmune', 'liver', 'disease', 'also', 'hypothyroidism', 'think', 'lactose', 'intolerance', 'think', 'gene', 'scary', 'stuff']","['celiac_disease', 'well', 'nafld', 'increased_risk', 'autoimmune', 'liver_disease', 'also', 'hypothyroidism', 'think', 'lactose_intolerance', 'think', 'gene', 'scary', 'stuff']"
39874,KaneHau,2020-02-26 20:38:46,"Yup.  Happened to me in my early 20's.  Could enjoy dairy all the way up till then... then suddenly - no more.

Genes turn off... and actually - it's normal (especially in non-european decent).",fiuwgzg,t3_f9znhd,/r/lactoseintolerant/comments/f9znhd/is_it_possible_to_suddenly_become_lactose/fiuwgzg/,2,lactoseintolerant,"['happened', 'early', 'could', 'enjoy', 'dairy', 'till', 'suddenly', 'gene', 'turn', 'actually', 'normal', 'especially', 'non-european', 'decent']","['happened', 'early', 'could', 'enjoy', 'dairy', 'till', 'suddenly', 'gene', 'turn', 'actually', 'normal', 'especially', 'non-european', 'decent']"
40188,Arminius2436,2020-02-12 15:48:13,"Well there's nothing you can do about it really.  Your genes to make lactase will either shut off as you get older, or they won't. Just remember that being able to consume dairy later in life is the vast minority of the human population--most east asians (&gt;90% of them) and many Africans are lactose intolerant.  There's still great food to be found if it happens to you",fhehgub,t3_f2syud,/r/lactoseintolerant/comments/f2syud/fear_of_getting_lactose_intolerance/fhehgub/,1,lactoseintolerant,"['well', 'nothing', 'really', 'gene', 'make', 'lactase', 'either', 'shut', 'older', 'remember', 'able', 'consume', 'dairy', 'later', 'life', 'vast', 'minority', 'human', 'population', 'east', 'asian', 'many', 'african', 'lactose', 'intolerant', 'still', 'great', 'food', 'found', 'happens']","['well', 'nothing', 'really', 'gene', 'make', 'lactase', 'either', 'shut', 'older', 'remember', 'able', 'consume', 'dairy', 'later_life', 'vast', 'minority', 'human', 'population', 'east_asian', 'many', 'african', 'lactose_intolerant', 'still', 'great', 'food', 'found', 'happens']"
40556,MyOtherAltIsAHuman,2020-01-29 22:10:35,"You have a limited understanding of what you're talking about, and yet you're so arrogant. It's a really ugly combination. A little learning is a dangerous thing. Drink deep, or taste not the Pierian spring.

https://www.ncbi.nlm.nih.gov/pmc/articles/PMC4899171/

*It is not clear how the lactase gene can be dramatically downregulated with age in most individuals, but remains active in some. We performed a comprehensive epigenetic study of the human and mouse intestine using chromosome-wide DNA modification profiling and targeted bisulfite sequencing. Epigenetically-controlled regulatory elements were found to account for the differences in lactase mRNA levels between individuals, intestinal cell types and species.*

I could quote many parts of that study to refute what you've said, but I don't think you're interested in learning. You just want to win an internet argument.

In layman's terms, DNA does play a role, but epigenetic factors are what determine lactose intolerance. You don't just become lactose intolerant at a certain age because of your DNA.",ffy01mn,t1_ffwiwlh,/r/lactoseintolerant/comments/ev6jqn/a_new_person_to_lactose_with_a_ended_world/ffy01mn/,1,lactoseintolerant,"['limited', 'understanding', 'talking', 'arrogant', 'really', 'ugly', 'combination', 'little', 'learning', 'dangerous', 'thing', 'drink', 'deep', 'taste', 'pierian', 'spring', 'clear', 'lactase', 'gene', 'dramatically', 'downregulated', 'individual', 'remains', 'active', 'performed', 'comprehensive', 'epigenetic', 'study', 'human', 'mouse', 'intestine', 'using', 'chromosome-wide', 'modification', 'profiling', 'targeted', 'bisulfite', 'sequencing', 'epigenetically-controlled', 'regulatory', 'element', 'found', 'account', 'difference', 'lactase', 'mrna', 'level', 'individual', 'intestinal', 'cell', 'type', 'specie', 'could', 'quote', 'many', 'part', 'study', 'refute', 'said', 'think', 'interested', 'learning', 'want', 'internet', 'argument', 'layman', 'term', 'play', 'role', 'epigenetic', 'factor', 'determine', 'lactose', 'intolerance', 'become', 'lactose', 'intolerant', 'certain']","['limited_understanding', 'talking', 'arrogant', 'really', 'ugly', 'combination', 'little', 'learning', 'dangerous', 'thing', 'drink', 'deep', 'taste', 'pierian', 'spring', 'clear', 'lactase', 'gene', 'dramatically', 'downregulated', 'individual', 'remains', 'active', 'performed', 'comprehensive', 'epigenetic', 'study', 'human', 'mouse', 'intestine', 'using', 'chromosome-wide', 'modification', 'profiling', 'targeted', 'bisulfite', 'sequencing', 'epigenetically-controlled', 'regulatory', 'element', 'found', 'account', 'difference', 'lactase', 'mrna', 'level', 'individual', 'intestinal', 'cell', 'type', 'specie', 'could', 'quote', 'many', 'part', 'study', 'refute', 'said', 'think', 'interested_learning', 'want', 'internet', 'argument', 'layman_term', 'play_role', 'epigenetic', 'factor', 'determine', 'lactose_intolerance', 'become', 'lactose_intolerant', 'certain']"
41065,NeedM0reInput,2020-01-07 08:21:46,"Yes. The genetic mutation to produce the lactase enzyme to breakdown lactose originated in western Europe, due to cows and the resulting benefits of a dairy diet.

I'm pretty sure I read somewhere that this is the only evidence of an actual gene mutation within the living population.",fdg93s2,t3_el8cve,/r/lactoseintolerant/comments/el8cve/are_some_racial_groups_genetically_more_likely_to/fdg93s2/,6,lactoseintolerant,"['genetic', 'mutation', 'produce', 'lactase', 'enzyme', 'breakdown', 'lactose', 'originated', 'western', 'europe', 'resulting', 'benefit', 'dairy', 'diet', 'pretty', 'sure', 'read', 'somewhere', 'evidence', 'actual', 'gene', 'mutation', 'within', 'living', 'population']","['genetic_mutation', 'produce', 'lactase', 'enzyme', 'breakdown', 'lactose', 'originated', 'western_europe', 'resulting', 'benefit', 'dairy', 'diet', 'pretty_sure', 'read_somewhere', 'evidence', 'actual', 'gene_mutation', 'within', 'living', 'population']"
41086,francerex,2020-01-06 17:04:48,"Talk to a doctor.

That said, I would take the breath test and the genetic test. If you have the gene that produces the enzyme you might just need to properly reintroduce lactose",fde3e0t,t3_ekvasg,/r/lactoseintolerant/comments/ekvasg/wife_and_daughter_have_been_lactose_intolerant/fde3e0t/,3,lactoseintolerant,"['talk', 'doctor', 'said', 'would', 'take', 'breath', 'test', 'genetic', 'test', 'gene', 'produce', 'enzyme', 'might', 'need', 'properly', 'reintroduce', 'lactose']","['talk_doctor', 'said', 'would', 'take_breath', 'test', 'genetic', 'test', 'gene', 'produce', 'enzyme', 'might', 'need', 'properly', 'reintroduce', 'lactose']"
43066,RhynoD,2019-10-02 13:19:44,"Sadly, no, it can't be reversed. It's genetic, a deactivation of the genes that build the enzyme lactase. I've heard that some people have mild success with probiotics to get good healthy bacteria to help you digest it but that will only make your symptoms milder, probably. 

It sucks, mate.",f26ss35,t3_dc50ld,/r/lactoseintolerant/comments/dc50ld/can_this_be_reversed/f26ss35/,1,lactoseintolerant,"['sadly', 'reversed', 'genetic', 'deactivation', 'gene', 'build', 'enzyme', 'lactase', 'heard', 'people', 'mild', 'success', 'probiotic', 'good', 'healthy', 'bacteria', 'help', 'digest', 'make', 'symptom', 'milder', 'probably', 'suck', 'mate']","['sadly', 'reversed', 'genetic', 'deactivation', 'gene', 'build', 'enzyme', 'lactase', 'heard', 'people', 'mild', 'success', 'probiotic', 'good', 'healthy', 'bacteria', 'help', 'digest', 'make', 'symptom', 'milder', 'probably', 'suck', 'mate']"
43202,KaneHau,2019-09-27 14:19:57,"Yes, it is normal in the majority of the population (especially non-europeans/white).  Your genes simply stop the production of what is needed to deal with the dairy.

This is normal because the majority of humanity stopped consuming a lot of dairy early on.

Where places were cooler, or had developed refrigeration, etc - diary consumption went on longer - thus those people are more tolerant.",f1mhgd9,t3_da0ztv,/r/lactoseintolerant/comments/da0ztv/intolerance_after_40/f1mhgd9/,1,lactoseintolerant,"['normal', 'majority', 'population', 'especially', 'non-europeans/white', 'gene', 'simply', 'stop', 'production', 'needed', 'deal', 'dairy', 'normal', 'majority', 'humanity', 'stopped', 'consuming', 'dairy', 'early', 'place', 'cooler', 'developed', 'refrigeration', 'diary', 'consumption', 'went', 'longer', 'thus', 'people', 'tolerant']","['normal', 'majority', 'population', 'especially', 'non-europeans/white', 'gene', 'simply', 'stop', 'production', 'needed', 'deal', 'dairy', 'normal', 'majority', 'humanity', 'stopped', 'consuming', 'dairy', 'early', 'place', 'cooler', 'developed', 'refrigeration', 'diary', 'consumption', 'went', 'longer', 'thus', 'people', 'tolerant']"
